video_id,comment_id,comment_text,sentiment_category,user_scenario,user_question,user_suggestion,positive_cluster_theme,negative_cluster_theme,scenario_cluster_theme,question_cluster_theme,suggestion_cluster_theme
v8TdcdK,c-0KPeWgS,Pro just develop bro codes,5.0,0.0,0.0,0.0,,,,,
vB3iY9I,c-0uMbk_C,Frivolous lawsuits are against the law!!!!! He needs to be punished for all his misdeeds,5.0,0.0,0.0,0.0,,,,,
v8TdcdK,c-4-XnVYb,Part 2 two pls I want to know what there punishment was face with tears of joy,5.0,0.0,0.0,0.0,,,,,
v8TdcdK,c-7CvRdAr,"I tried using the Xfaiyx Translator during my trip to Japan, and it worked flawlessly! Highly recommend it.",1.0,1.0,0.0,0.0,,,,,
vWN5LPe,c-9SGtvvf,"I’ve been using the Xfaiyx Smart Translator during my remote work calls with international clients, and it’s been a game-changer!",1.0,1.0,0.0,0.0,,,,,
vKlzOiZ,c-AkSdZpM,와 금리가 40프로라니...뉴스에 크게 나온것도 없던데 무슨 일이 있나보군요,5.0,0.0,0.0,0.0,,,,,
vB3iY9I,c-CwWaLDC,I will never understand why people give this ...person any of their attention (outside of topics like this video) or money. It's insane.,5.0,0.0,0.0,0.0,,,,,
vTdqmte,c-GHS6zeS,Just wouldn't be the same without mechanical failures!,5.0,0.0,0.0,0.0,,,,,
vJUEX3u,c-JXY0ZIb,face with tears of joy face with tears of joy face with tears of joy,5.0,0.0,0.0,0.0,,,,,
vb-WyHa,c-K6qJkzA,You are in the list of favorites,5.0,0.0,0.0,0.0,,,,,
v8TdcdK,c-QBSA0QA,We're Cooked cooked rice -Rip Nero and Nick,5.0,0.0,0.0,0.0,,,,,
vB3iY9I,c-SUT2l1L,Then there's the little issue of LP thanking CZ for his work...,5.0,0.0,0.0,0.0,,,,,
v8TdcdK,c-SecFKk9,"face with tears of joy face with tears of joy face with tears of joy face with tears of joy face with tears of joy face with tears of joy face with tears of joy face with tears of joy face with tears of joy face with tears of joy face with tears of joy face with tears of joy face with tears of joy Ha ha. Haha, ha ha ha. That's funny funny. face with tears of joy face with tears of joy face with tears of joy face with tears of joy face with tears of joy face with tears of joy face with tears of joy face with tears of joy face with tears of joy face with tears of joy",5.0,0.0,0.0,0.0,,,,,
vUt-uCX,c-UefLg7I,bro's deluluing,5.0,0.0,0.0,0.0,,,,,
vTdqmte,c-Wf1YQq8,"If you ever get sick & tired of Tamara, just ship her to Washington state in the US. I will pay for shipping face with tears of joy",5.0,0.0,0.0,0.0,,,,,
vUt-uCX,c-jpMgUuo,Bro you wearing cross grinning face with sweat,5.0,0.0,0.0,0.0,,,,,
vB3iY9I,c-nJ3-Hnj,Logan is........weird!!!,5.0,0.0,0.0,0.0,,,,,
v8TdcdK,c-nylf_Kj,Adorable couple smiling face with hearts,5.0,0.0,0.0,0.0,,,,,
v1hWN0s,c-pQNO8HY,The s24 ultra does this already for free loudly crying face,2.0,0.0,0.0,0.0,,,,,
v8TdcdK,c-r4cz5sw,What happened tou your TV did you guys buy a new one?,5.0,0.0,0.0,0.0,,,,,
vKlzOiZ,c-rjaIiy4,굿~,5.0,0.0,0.0,0.0,,,,,
v8TdcdK,c-ssup7KH,Bhai Aaj to gya grinning face with sweat grinning face with sweat grinning face with sweat grinning face with sweat grinning face with sweat,5.0,0.0,0.0,0.0,,,,,
v8TdcdK,c-tMZksnU,face with tears of joy face with tears of joy face with tears of joy face with tears of joy face with tears of joy face with tears of joy thong sandal thong sandal thong sandal thong sandal thong sandal,5.0,0.0,0.0,0.0,,,,,
vbesCCb,c-xp3emHd,"Ich habe es in einem Restaurant in Frankreich benutzt, und es hat mir geholfen, die Speisekarte zu verstehen. Sehr praktisch!",1.0,1.0,0.0,0.0,,,,,
v1hWN0s,c-zWnAF0-,how can I purchase it?,1.0,0.0,1.0,0.0,,,,,
vB3iY9I,c072BX1HK,What's a dinkdoink?,5.0,0.0,0.0,0.0,,,,,
v8TdcdK,c07BeitSJ,Do you know japanese Nick? Pin mee red heart,5.0,0.0,0.0,0.0,,,,,
vbesCCb,c093hjdoO,@NerdsHeaven.de smiling face with sunglasses,5.0,0.0,0.0,0.0,,,,,
vQjtjf2,c09ECTxDh,primera red heart,5.0,0.0,0.0,0.0,,,,,
vB3iY9I,c09jbfnI4,"Do you mind to change the term from ""E #d their own lives"" to ""cancel themselves""? Some people have been doing similar things because of YouTube... But it's rather funny how often Logan Paul trys to cancel himself. Like if you think this is funny party popper !!",5.0,0.0,0.0,0.0,,,,,
vKlzOiZ,c0A8ZqooI,"에르도안 이라는 멍청한 대통령을 뽑은 국민들 잘못이지!! ᄏ 한국에서 물가가 저렇게 오르고, 금리가 42% 되었서 봐라!!! ᄏᄏ 미국하고 거리두고, 러시아와 친해지면 어떻게 되는지 봐라!!! 한국인들은 제발 감사하면서 살아!!!! 정신 차리고 !!! ps) 터키 대통령은 저 와중에 스텔스 전투기 만든다고 수십조을 쏟아붓고 있으니.... 국민들이 진실을 알고 정신차려야 합니다.",5.0,0.0,0.0,0.0,,,,,
vpOtjW1,c0Alhb4wD,"For example situation in German IT is grimm, there is no any demand now. Working here for 10 years and in my current place and all places I worked before there layoffs instead of hiring. And the situation doesn't look like it will change soon. I don't see any reason why it would change. International companies prefer hiring in cheaper countries. German companies also, for example, they moved 90 percent development for Deutsche Telekom to Spain. There everything is cheaper, nothing personal just business.",5.0,0.0,0.0,0.0,,,,,
vhTHDT-,c0Fj4HUlk,"Haha, looks like our translator nailed it! Glad you found it so accurate. Wish you and your bf stay happy winking face",1.0,0.0,0.0,0.0,,,,,
vB3iY9I,c0FvrUJXg,"I do think that there are youtubers that put out videos literally to shark others and gain their own success. I would be totally weirded out having my clipped videos and pictures all over somebody's channel, and thumbnailed with production quality, in a narrative all about me... just sayin. But I do think Logan Paul should be more responsible, and wouldn't be defamed and actually would gain public trust by actually taking action for the cryptozoo issue. So he basically defamed himself for not taking any action when he said he would.",5.0,0.0,0.0,0.0,,,,,
v1hWN0s,c0GgLl75v,how much is the price,1.0,0.0,1.0,0.0,,,,,
v3T6mPl,c0KAcgC5M,250$Nope,2.0,0.0,0.0,0.0,,,,,
v8TdcdK,c0MTuQVFr,Google Translate got left,4.0,0.0,0.0,0.0,,,,,
vTdqmte,c0QiUA6Tw,Did you try contacting the British Embassy or Consulate to get your package into the country?,5.0,0.0,0.0,0.0,,,,,
vb-WyHa,c0RBKVVSp,I like your photo double exclamation mark bright button,5.0,0.0,0.0,0.0,,,,,
ve33QLn,c0Rkxk0Qg,¿Cuánto dura la batería? Necesito algo que aguante todo el día.,4.0,1.0,1.0,0.0,,,,,
v8TdcdK,c0Soz5uZ3,That escapee rolling on the floor laughing rolling on the floor laughing rolling on the floor laughing rolling on the floor laughing rolling on the floor laughing,5.0,0.0,0.0,0.0,,,,,
v8TdcdK,c0Xuf3Dqn,Apnavi and Carrie are so beautiful and cute ya. smiling face with smiling eyes red heart,5.0,0.0,0.0,0.0,,,,,
vUt-uCX,c0atvVYO4,Amigo es mas bajo que Messi face with tears of joy,5.0,0.0,0.0,0.0,,,,,
v8TdcdK,c0ijcO8Iv,That was pretty I love this video,5.0,0.0,0.0,0.0,,,,,
vTdqmte,c0jE3DHLb,"The Xfaiyx Smart Translator helped me navigate local markets in Asia, but I wish it had a faster response time for real-time conversations.",3.0,1.0,0.0,1.0,,,,,
v8TdcdK,c0jTcH5GT,Goodbye boys waving hand medium-light skin tone,5.0,0.0,0.0,0.0,,,,,
vB3iY9I,c0jhTURej,"Logan Paul is something special. Were people scammed out of money? Yes, because the game wasn't delivered. Was Logan Paul the face of CryptoZoo? Yes. Was he the main beneficiary? Yes. Did he promise to deliver and then not do it? Yes. Did he promise a refund and then not do it? Yes. If he had it in his heart or not at the beginning to not delivery isn't relevant. He didn't deliver, people lost out, he promised to correct it and make people whole, he didn't do it.",5.0,0.0,0.0,0.0,,,,,
vb-WyHa,c0kE0WOU2,Wow you beaming face with smiling eyes,5.0,0.0,0.0,0.0,,,,,
v8TdcdK,c0kd3588G,Carrie brings his technique the languange face with tears of joy face with tears of joy,5.0,0.0,0.0,0.0,,,,,
v8TdcdK,c0lwA_9Hk,You very chalak bro face with tears of joy,5.0,0.0,0.0,0.0,,,,,
vB3iY9I,c0o2-5xOR,Someone should probably tell Logan Paul about discovery.,5.0,0.0,0.0,0.0,,,,,
v3T6mPl,c0tIET4ae,Can u tell me what part of that is AI?,4.0,0.0,1.0,0.0,,,,,
vb-WyHa,c0uHie-aD,smiling face with hearts smiling face with hearts smiling face with hearts smiling face with hearts,5.0,0.0,0.0,0.0,,,,,
vUt-uCX,c0vNNSNmV,Defo buying this with your code thumbs up medium-dark skin tone,1.0,0.0,0.0,0.0,,,,,
v8TdcdK,c0yzlsLyl,Nick:shocked Carrie:rocked,5.0,0.0,0.0,0.0,,,,,
vmCnKGQ,c0zc4GTSl,"The audio quality is surprisingly clear, even in crowded places. Perfect for interviews or lectures!",1.0,1.0,0.0,0.0,,,,,
v1hWN0s,c1-2LxdIT,can it transcribe shona?,4.0,0.0,1.0,0.0,,,,,
vUt-uCX,c1-b7KUNS,they never give you an answer you wanted,2.0,0.0,0.0,0.0,,,,,
vB3iY9I,c107YpUWD,Coffee Zilla #DayOneCrewLesshGo flag in hole,5.0,0.0,0.0,0.0,,,,,
vKlzOiZ,c12exjhRV,Merry Christmas to celebrating brothers in Turkiye Christmas tree sparkles,5.0,0.0,0.0,0.0,,,,,
vhTHDT-,c155Y-Jcj,this is my fav couple fr,5.0,0.0,0.0,0.0,,,,,
vWN5LPe,c18ienRns,"I’ve been using the Xfaiyx Smart Translator while working remotely in London, and it’s made communicating with my international team so much easier!",1.0,1.0,0.0,0.0,,,,,
vhTHDT-,c19LSR8rn,invissible camera rolling on the floor laughing hundred points,5.0,0.0,0.0,0.0,,,,,
v8TdcdK,c1C-tEonf,Nick trying to escape is so funny face with tears of joy,5.0,0.0,0.0,0.0,,,,,
vhTHDT-,c1CzCgat7,"I want that gadget, Carrie where to buy?",1.0,0.0,1.0,0.0,,,,,
v8TdcdK,c1DVA1EhI,Carrie stop caring about a friend’s conversation,5.0,0.0,0.0,0.0,,,,,
ve33QLn,c1ECy-Cpp,"La calidad de audio no es buena, deberían mejorar los altavoces.",2.0,0.0,0.0,1.0,,,,,
vJUEX3u,c1I5etXh0,"Kann der Xfaiyx auch offline arbeiten? Ich brauche etwas, das ohne Internet funktioniert.",4.0,0.0,1.0,0.0,,,,,
vhTHDT-,c1J68O7y-,smiling face with halo smiling face with halo smiling face with halo,5.0,0.0,0.0,0.0,,,,,
vbesCCb,c1MVr6Wgb,Bro ein App und du bist OK une diese dig hier face with tears of joy grinning face with sweat grinning face with sweat rolling on the floor laughing grinning squinting face grinning squinting face grinning squinting face,5.0,0.0,0.0,0.0,,,,,
v8TdcdK,c1PJXr6BZ,"""Hye apnavi , Niro is there!"" ""Carrie is there smirking face "" Bro grinning face with sweat face with tears of joy",5.0,0.0,0.0,0.0,,,,,
vhTHDT-,c1PXg2RjV,This is prolly scripted but it’s funny loudly crying face,5.0,0.0,0.0,0.0,,,,,
v8TdcdK,c1RDrfy7c,You are such a baby carrie,5.0,0.0,0.0,0.0,,,,,
vr9Mebt,c1Saiz4x-,"Tried using Xfaiyx at a business meeting, but it kept mistranslating technical terms. Not ideal for professional use.",2.0,1.0,0.0,0.0,,,,,
vB3iY9I,c1W9m27ls,"i heard there was a doggie in the background so that's why i'm here. im not disappointed, that is a good doggie",5.0,0.0,0.0,0.0,,,,,
vKlzOiZ,c1Z9AAzOb,에르도안 뽑은 본인들 책임이지 뭐 누굴 탓하겠음... 흠흠....,5.0,0.0,0.0,0.0,,,,,
vB3iY9I,c1dNBD2n1,How isn't prime a scam yet?,5.0,0.0,0.0,0.0,,,,,
v1hWN0s,c1ddfh8fS,"This looks super useful for interviews, especially with the noise reduction feature! thumbs up",1.0,1.0,0.0,0.0,,,,,
vb-WyHa,c1hQxPbds,How fast is the translation speed compared to apps like iTranslate?,4.0,0.0,1.0,0.0,,,,,
vKlzOiZ,c1iffbqKy,한국은 과연 안전할까... 튀르키에랑 한국은 분명히 다른 나라이지만... 우리도 스스로 안전한지 돌아봐야 할듯한데...,5.0,0.0,0.0,0.0,,,,,
vmCnKGQ,c1m7U3QOK,Is there a smartphone app for managing?,4.0,0.0,1.0,0.0,,,,,
vKlzOiZ,c1oC8c1Kd,우리나라도 내란성공햇으면 저렇게됫어요 터키가 계엄해서 정권독재하고있는 나라잖아요,5.0,0.0,0.0,0.0,,,,,
vB3iY9I,c1pajS3cq,Coffeezilla is the reason why we have 1'000 Logan / Jake Pauls instead of 10'000,5.0,0.0,0.0,0.0,,,,,
v8TdcdK,c2-iT6lJN,Ur such a green flag Carrie,5.0,0.0,0.0,0.0,,,,,
vbesCCb,c21iArNwx,"Mein s24 ultra macht das besser! Vorallem kann man mehrere Anbieter verwenden und ich denke nicht dass ihr den besten Übersetzer verwendet ""deepl""",2.0,0.0,0.0,0.0,,,,,
v8TdcdK,c23Knr2Hv,"AWOOP, JUMPSCARE!!",5.0,0.0,0.0,0.0,,,,,
vhTHDT-,c26OUC_8f,early yayyy,5.0,0.0,0.0,0.0,,,,,
vb-WyHa,c2EQYSbTV,This would have been so helpful during my last vacation in Europe!,1.0,1.0,0.0,0.0,,,,,
vB3iY9I,c2GVpcvvU,"can't wait for discovery to require the entire group chat history of everything and LP's transaction history for previous ""incidents"" etc to become part of the public record.",5.0,0.0,0.0,0.0,,,,,
vJUEX3u,c2H1Ye_RD,There is a method where you ask your subconscious something that you have forgotten and you have to stand up. If you tilt forward it is a yes and if no it is backwards,5.0,0.0,0.0,0.0,,,,,
vB3iY9I,c2HvwhwWb,"""Let me just explain to you how things work around here.. GUGHH!!""",5.0,0.0,0.0,0.0,,,,,
v1hWN0s,c2O0qg1hk,please give me folded hands,1.0,0.0,0.0,0.0,,,,,
vpOtjW1,c2VITcQsb,will able to get IT job without experience. doing some certificate courses in Germany?,5.0,0.0,0.0,0.0,,,,,
v8TdcdK,c2XM6yZaC,Now this os what you call women looking out for one another .. nio is there and Carrie is there face with tears of joy grinning face with sweat red heart,5.0,0.0,0.0,0.0,,,,,
vB3iY9I,c2aSSZL3j,"Logan paul gets sued left and right lol. olympic committee, coffeezilla, his prime bottling company, and the crypto scam thing. 2025 will be a pretty dark year for him.",5.0,0.0,0.0,0.0,,,,,
vB3iY9I,c2dqIhhrS,"It is rather funny that Logan constantly said in every video I have seen about his alleged scams, that “HE” created these projects. “Crypto zoo is a project I created” that’s publicly taking responsibility for the project. To later try and distance himself from the project doesn’t really work when he openly took responsibility for it when pushing the currency.",5.0,0.0,0.0,0.0,,,,,
v8TdcdK,c2gchYe_9,Cariie is there slay gueen comes,5.0,0.0,0.0,0.0,,,,,
v8TdcdK,c2hXIGRRa,I want to ask you something Are you tow of different relegion,5.0,0.0,0.0,0.0,,,,,
vhTHDT-,c2iSVJeZN,early,5.0,0.0,0.0,0.0,,,,,
v8TdcdK,c2poGAsHe,Bro you shouldn't be nosey,5.0,0.0,0.0,0.0,,,,,
vKlzOiZ,c2qXRQyTu,"이집트에 살면서 터키 자주 가는데, 물가가 어마어마하게 많이 오르긴 했더라구요.. 이집트도 물론이고. 그 주변 국가들이 다 어려운 것 같아요. 터키도 한국도 경제가 하루빨리 안정되었으면 좋겠네요ᅲ 행복한 연말 보내세요:)",5.0,0.0,0.0,0.0,,,,,
v8TdcdK,c2tM4EKXV,:nick Hi Apnavi Niro's there smiling face with tear :Apnavi CARRIE'S THERE (slaps Nick with a slipper),5.0,0.0,0.0,0.0,,,,,
vUt-uCX,c2tMcQpCQ,nayeem utd too short skull,5.0,0.0,0.0,0.0,,,,,
vUt-uCX,c2wGO_AGw,bros so small compared to everyone loudly crying face loudly crying face loudly crying face loudly crying face loudly crying face,5.0,0.0,0.0,0.0,,,,,
vUt-uCX,c32PdM4dT,Guntu,5.0,0.0,0.0,0.0,,,,,
v8TdcdK,c35uCdDMO,Not nick throwing niro under the bus face with tears of joy,5.0,0.0,0.0,0.0,,,,,
v1hWN0s,c36Yzqc-1,prob a Chinese product. show us the noise cancelling in a club,4.0,1.0,0.0,0.0,,,,,
v8TdcdK,c3FPqv_s0,face with tears of joy face with tears of joy face with tears of joy,5.0,0.0,0.0,0.0,,,,,
vKlzOiZ,c3HG-p6Hh,정치가 진짜 중요해요 국민들이 잘살려면... 튀르키에도 결국 계엄 및 정치 불안이 영향이 있는거죠. 우리도 현재 비정상 사태가 대다수 국민이 원하는대로 얼릉 안정되길 바래 봅니다,5.0,0.0,0.0,0.0,,,,,
vB3iY9I,c3I3z6R_P,"I hope this lawsuit will be the end of Logan Paul, I mean this dude should be in jail.",5.0,0.0,0.0,0.0,,,,,
vB3iY9I,c3KP8xAz6,"I really hope it does get to discovery, Logan and his partner in this crypto was also the same dude who showed Logan how to pump and dump with Pokemon cards and was part of that ""3.5 million"" dollar loss on that box",5.0,0.0,0.0,0.0,,,,,
v1hWN0s,c3P5ojGwA,thought it was an ipod nano hahaha,5.0,0.0,0.0,0.0,,,,,
vKlzOiZ,c3RrMpXoT,터키 경제상황이 정말 좋지 않은게 느껴지네요! 우리나라도 경제가 좋지만은 않지만 그래도 대한민국에 태어나 사는것이 축복이라는 건 확실한것 같아요! 연말 가족과 즐겁게 보내시고 내년도 행복한 여행을 함께 해보아요! 캐럿맨 포에버 red heart red heart red heart,5.0,0.0,0.0,0.0,,,,,
vTdqmte,c3VD552sy,I love the idea of using the Xfaiyx Smart Translator during road trips! It could make meeting locals and exploring new cultures so much easier.,1.0,1.0,0.0,0.0,,,,,
v8TdcdK,c3cST-ua8,Part 2 pls is so funny beaming face with smiling eyes face with tears of joy backhand index pointing down,5.0,0.0,0.0,0.0,,,,,
v8TdcdK,c3jJawyIY,Wait who is filming then,5.0,0.0,0.0,0.0,,,,,
vhTHDT-,c3mZ_CXxk,i need it to learn Spanish,1.0,1.0,0.0,0.0,,,,,
vUt-uCX,c3nzRR8BU,rolling on the floor laughing rolling on the floor laughing rolling on the floor laughing laugh without laughing,5.0,0.0,0.0,0.0,,,,,
vB3iY9I,c3t4opXCN,Great video. And I subscribed simply because you have a cute dog having a good snooze service dog sleeping face,5.0,0.0,0.0,0.0,,,,,
vhTHDT-,c4-1fyytN,face with tears of joy face with tears of joy face with tears of joy,5.0,0.0,0.0,0.0,,,,,
vmCnKGQ,c4-xPhMGP,Can you transfer recordings wirelessly to your phone or laptop?,4.0,0.0,1.0,0.0,,,,,
vmCnKGQ,c40otxbrT,Thanks for share bro. Great Review,5.0,0.0,0.0,0.0,,,,,
vB3iY9I,c41dZ8KYx,"I bought the Xfaiyx Smart Recorder for my journalism work, and it's been a game-changer. The audio clarity is unmatched!",1.0,1.0,0.0,0.0,,,,,
vKlzOiZ,c421AJT5p,우리나라도 심각합니다. 심하게 망쳐놨죠?ᅲ,5.0,0.0,0.0,0.0,,,,,
vB3iY9I,c46kcrH1G,"You don’t need to be a lawyer to see this for what it is. A stfu please lawsuit lol. Or if you want to go by its more boring name, a slap suit. Paul is scared and is lashing out throwing around his weight and the only thing he has on coffee, his money bags. I hope coffee counter sues thumbs up",5.0,0.0,0.0,0.0,,,,,
vhTHDT-,c49nEgOVq,face with tears of joy,5.0,0.0,0.0,0.0,,,,,
v8TdcdK,c49vrqz7I,Hi apanvi niro is there The Carrie is there you both are dead,5.0,0.0,0.0,0.0,,,,,
v8TdcdK,c4BaQdFFq,LOL face with tears of joy face with tears of joy face with tears of joy face with tears of joy,5.0,0.0,0.0,0.0,,,,,
vB3iY9I,c4D96jFpX,If he wants a sure fire win on defamation of reputation Logan should sue himself.,5.0,0.0,0.0,0.0,,,,,
vKlzOiZ,c4DHctbfU,터키 리라화가 하락을 계속하고 있고 리라화가 엄청난 약세를 보이면 수입하는 물가는 그만큼 올라가고 인플레이션이 심해지죠. 인플레이션이 심화되는데 경제가 나쁘면 스테그 플레이션이 되는데 실질 임금은 줄고 물가는 오르면서 2중의 고통을 당하는거죠. 근데 더 문제는 터키의 경제가 살아날 기미를 보이지 않으니 실제로 터키사람들의 생활수준은 계속해서 하락할 수 밖에 없는거죠. 터키의 기준금리는 50%입니다. 터키는 2023년 5월 25일날 8%였는데 꾸준히 기준금리를 올려서 리라화를 방어할려고 계속 금리를 올려 50%까지 올렸지만 방어가 안 되는 불능의 상태가 되었습니다. 금리가 오르면 통화가 보통을 강세가 되는데 리라화는 금리를 엄청나게 올려도 환율이 방어가 안되면서 물가는 오르고 금리가 높으니 경제가 엄청나게 침체를 맞는거죠. 금리가 높으면 은행대출이자는 더 높고 대출을 받아 사업을 운영할 자금을 빌리 수도 없고 기업들이 수익이 나도 은행 이자도 못 값는 일이 발생하면서 파산이 생기고 실업자가 늘면서 거의 경제가 엉망진창이 되어버리죠.문제는 터키은행이자가 아무리 높아도 환율이 방어가 안되면 터키의 높은 이자를 받아서 잠시 행복하겠지만 터키 리라화가 계속 떨어지면 환차손이 발생해 받은 이자 이상으로 손실이 날 수도 있다는겁니다. 환율이 방어가 안되면 결국 미래는 암흑이며 베네수엘라처럼 하이퍼 인플레이션이 될 수도 있다는 겁니다.,5.0,0.0,0.0,0.0,,,,,
vUt-uCX,c4EbsH6mN,face with tears of joy face with tears of joy,5.0,0.0,0.0,0.0,,,,,
v3T6mPl,c4Hlqz9Du,Cool gadget!!,1.0,0.0,0.0,0.0,,,,,
v8TdcdK,c4IPJ0cCY,Translate to swedish,4.0,0.0,1.0,0.0,,,,,
vB3iY9I,c4OBOn4pP,"has this guy not watched The Wrestler? he's gonna be broke, living in a trailer park when he's old.",5.0,0.0,0.0,0.0,,,,,
v1hWN0s,c4QVuVQ9B,what are the AI features,4.0,0.0,1.0,0.0,,,,,
vhTHDT-,c4VOiEyyC,"Not sure about this translator, seems like it might struggle with complex sentences grinning face with sweat",2.0,0.0,0.0,0.0,,,,,
v8TdcdK,c4Vy-QnOd,Sorry nick carrie won today face with tears of joy face with tears of joy red heart,5.0,0.0,0.0,0.0,,,,,
vB3iY9I,c4WKNHspu,"Great video, thank you!! I hope Coffeezilla watches.",5.0,0.0,0.0,0.0,,,,,
vKlzOiZ,c4WvkUPU8,이게 남의일이 아니게될것같아 씁쓸하네,5.0,0.0,0.0,0.0,,,,,
vr9Mebt,c4X6Yty3S,Welcome I flow you all your video I so happy I'm your student from Eritrean,5.0,0.0,0.0,0.0,,,,,
v8TdcdK,c4c-4gLGN,Not being mean but chesme face with tears of joy,5.0,0.0,0.0,0.0,,,,,
v8TdcdK,c4cFuDFW-,"""Acha na nigga"" got me dying skull skull raised fist",5.0,0.0,0.0,0.0,,,,,
vQjtjf2,c4d8diW9B,"Les va quitar el trabajo a los intérpretes profesionales, pero es una herramienta impresionante.",3.0,0.0,0.0,0.0,,,,,
vB3iY9I,c4hG7GDD1,"I used the Xfaiyx Smart Recorder during a podcast session, and it worked flawlessly. The sound clarity is top-notch!",1.0,1.0,0.0,0.0,,,,,
vB3iY9I,c4jFTOk_U,This guy needs to be in prison.,5.0,0.0,0.0,0.0,,,,,
vbesCCb,c4mruN94p,"Vorstellbar, dass das Gerät wöchentlich nach möglichen Update schreit und so dann doch bei einem Update zur Marktforschung Daten nicht nur herunter sondern auch hoch laden wird beaming face with smiling eyes",2.0,0.0,0.0,0.0,,,,,
v8TdcdK,c4pRZT6LL,that speedy escape though face with tears of joy face with tears of joy face with tears of joy,5.0,0.0,0.0,0.0,,,,,
vhTHDT-,c4rKE9Q9X,huh,5.0,0.0,0.0,0.0,,,,,
vTdqmte,c4sRTDoOi,"I regret buying the Xfaiyx Smart Translator. It’s overpriced for what it offers, and the app crashes way too often.",2.0,0.0,0.0,0.0,,,,,
vB3iY9I,c5-GoCbVC,"I mean... Logan asserted multiple times his ""ownership"" of the project. And its provably a scam at this point. So it being refered to as ""Logans scam"" is quite reasonable.",5.0,0.0,0.0,0.0,,,,,
vhTHDT-,c52yxLeRw,"I used it during a business meeting and it helped a lot, but the translations felt robotic.",3.0,1.0,0.0,0.0,,,,,
v4g6avX,c53CWoJez,Can I use this for business meetings? Seems like a great tool for professionals!,1.0,1.0,1.0,0.0,,,,,
vmCnKGQ,c59DsjQ2s,"It’s a good device overall, but I’d love to see an option to edit recordings directly on it.",3.0,0.0,0.0,1.0,,,,,
vWN5LPe,c59MLsejY,Holly's watermellon logo shows that she was a Palestine supporter before it was a thing smiling face with smiling eyes,5.0,0.0,0.0,0.0,,,,,
vB3iY9I,c5C4YNgzJ,Absolutely wild that people like Logal Paul punish people who follow him and people...continue to follow him,5.0,0.0,0.0,0.0,,,,,
v8TdcdK,c5Cec3kJk,what an evil mastermind face with tears of joy,5.0,0.0,0.0,0.0,,,,,
v8TdcdK,c5GZDrALo,Bruh carrie living in nicks house hitting him with the flying ultimate slipper lol face with tears of joy face with tears of joy face with tears of joy face with tears of joy face with tears of joy face with tears of joy face with tears of joy face with tears of joy face with tears of joy,5.0,0.0,0.0,0.0,,,,,
v8TdcdK,c5HrfyTNe,They got cooked like a pizza,5.0,0.0,0.0,0.0,,,,,
v8TdcdK,c5Jru5c6m,carrie there's *here comes the scary sliper warning have fun* face with tears of joy face with tears of joy face with tears of joy face with tears of joy,5.0,0.0,0.0,0.0,,,,,
vpOtjW1,c5QLxfPkh,"German is becoming new elite language these days!! like 30 years before very few people can speak English, and were considered to be elite!!! bye bye English.",5.0,0.0,0.0,0.0,,,,,
vhTHDT-,c5YuPoA1A,rolling on the floor laughing rolling on the floor laughing rolling on the floor laughing,5.0,0.0,0.0,0.0,,,,,
vhTHDT-,c5_PLhBv2,face with tears of joy face with tears of joy face with tears of joy,5.0,0.0,0.0,0.0,,,,,
vB3iY9I,c5b67-IuE,"HE did not sell, but his staff likely did on his behalf",5.0,0.0,0.0,0.0,,,,,
v8TdcdK,c5fsVkno5,Is that his sister?,5.0,0.0,0.0,0.0,,,,,
v8TdcdK,c5hBwPQG3,Why always u bother nick,5.0,0.0,0.0,0.0,,,,,
vUt-uCX,c5l8qbqy2,Interview shorter ppl,5.0,0.0,0.0,0.0,,,,,
vKlzOiZ,c5oIaEeJU,일빠,5.0,0.0,0.0,0.0,,,,,
vKlzOiZ,c5oTUvBtj,"제품 디자인은 정말 세련됐는데, 번역 속도가 조금 느린 것 같아요. 개선되면 더 좋을 것 같습니다.",3.0,0.0,0.0,1.0,,,,,
v8TdcdK,c5r3QW5yP,I know I’m not related but pls pls pls do not break up,5.0,0.0,0.0,0.0,,,,,
vTdqmte,c5r6FSGmA,Never give up ! You guys are doing it... Albeit the hard way but with grace and guts. Strength and good health to you all,5.0,0.0,0.0,0.0,,,,,
vUt-uCX,c5sAC1k-b,you are down to earth face with tears of joy face with tears of joy face with tears of joy,5.0,0.0,0.0,0.0,,,,,
v8TdcdK,c5vMkCgvY,CARRIE IS THERE,5.0,0.0,0.0,0.0,,,,,
v8TdcdK,c63LUyDQ4,you guys can break up idc,5.0,0.0,0.0,0.0,,,,,
v8TdcdK,c65bKJNpx,Carrie is there got me rolling red heart,5.0,0.0,0.0,0.0,,,,,
v8TdcdK,c676YBxal,Promotion karne ka tarika thida casual hai face with tears of joy face with tears of joy face with tears of joy,5.0,0.0,0.0,0.0,,,,,
vbesCCb,c67x8zahu,Braucht es WLAN?,4.0,0.0,1.0,0.0,,,,,
vb-WyHa,c6Ac2s49X,Why not just use Google Translate on your phone? Seems redundant.,2.0,0.0,0.0,0.0,,,,,
v8TdcdK,c6HBKdb6k,Love apnavi entry and when she says Carrie is there,5.0,0.0,0.0,0.0,,,,,
vhTHDT-,c6HPjWqYw,haha the part when they said niros there carries there aAhhHHH,5.0,0.0,0.0,0.0,,,,,
