video_id,comment_id,comment_text,sentiment_category,user_scenario,user_question,user_suggestion,positive_cluster_theme,negative_cluster_theme,scenario_cluster_theme,question_cluster_theme,suggestion_cluster_theme
vRoMHNQ,cMsI3IeYr,この翻訳機は充電時間がどのくらいかかりますか?旅行中に頻繁に使う予定なので知りたいです。,,,,,,,,,
vgIkaeR,cMup2UWCG,Ere muy guapo y dulce me gusta cuando te rie ilumina mi vida red heart,,,,,,,,,
vOREHMM,cMvRA43Bg,What's the maximum number of languages it supports?,,,,,,,,,
vyTFg05,cMwP1ztyc,"Aap ki village wali vlog daikh boht acha feel hota hai kitna peace ful environment hai ,,saal m 15 days atleast yahan rehna chahiye... alhamdulillah your r so blessed Masha Allah Masha Allah",,,,,,,,,
v4wSOpe,cMwSBToG9,perfect device for kids like mine that dont have smart phones and want to record her own music.,,,,,,,,,
vOU2rJb,cMwssKnQw,The battery life on the Xfaiyx Smart Recorder is disappointing. It barely lasted through a full day of recording sessions.,,,,,,,,,
vIiTZO1,cN0TUt5xb,face with tears of joy face with tears of joy,,,,,,,,,
vgIr-dG,cN1_wMlgF,Amazing red heart red heart red heart,,,,,,,,,
vjEBu9W,cN2sO1Oq5,Love that you guys went to Geylang Serai and the Joo Chiat area. It's a food paradise here. This is my neighbourhood! Thank you!,,,,,,,,,
vwm_9ft,cN4IT0zv8,smiling face with hearts smiling face with hearts smiling face with hearts,,,,,,,,,
vc_of-A,cN5477MdH,face with tears of joy face with tears of joy face with tears of joy face with tears of joy,,,,,,,,,
vyTFg05,cN6cFOSYy,amazing place best natural feeling red heart party popper Nice vlog,,,,,,,,,
v3-vK-4,cN8lwOp9V,red heart ma guarda chi c'è?,,,,,,,,,
vJAQbN9,cN8p_ESzq,Google Übersetzer ist fürn arsch face with rolling eyes,,,,,,,,,
vyTFg05,cN93bBeZo,Masha'allah Masha'allah apke videos ka wait kar raheti Masha'allah bhot beautiful hai aplog ka house house I wish k mre bhi koi hote waha loudly crying face,,,,,,,,,
vgIr-dG,cN9JgQeHt,Why's China so dirty,,,,,,,,,
vvyoPyo,cN9SK06jM,"I bought this for my parents who travel often, and they love it! But I wish the battery lasted longer.",,,,,,,,,
vOU2rJb,cN9Zx20gO,"Your unboxing of the Xfaiyx Smart Recorder was thorough and well-presented. The device looks sleek and compact, making it ideal for various recording needs.",,,,,,,,,
vIiTZO1,cNAZ-p-00,smiling face with hearts smiling face with hearts,,,,,,,,,
vyumcj7,cNEBhuEYi,Can it be translated into any language?,,,,,,,,,
vz0mnPd,cNGa43y60,Jetzt bei Amazon Prime Day im Angebot am 16. und 17. Juli! Sichern dir jetzt den Xfaiyx Smart Translator für nur 292 €. Schnell noch Angebot sichern party popper,,,,,,,,,
vtFQ8Km,cNGd3artj,"Das Gerät sieht echt praktisch aus, besonders für Reisen! Ich überlege, ob ich es mir holen soll.",,,,,,,,,
vyTFg05,cNGtYBVFo,Your way of shooting is so perfect clapping hands I was focusing it on the first part of the video so perfectly you captured very thing red heart great work and effort,,,,,,,,,
vUG_xbR,cNH6IVtFi,I want to buy it now! ! ! ! ! ! !,,,,,,,,,
vVS_NZR,cNJ5WyYN3,"Es una herramienta interesante, pero nada reemplaza a una persona que realmente aprende el idioma. Esto es solo una solución temporal.",,,,,,,,,
vMSQja0,cNJdZDJxw,"這個翻譯機很棒啊,看多次試機都翻譯得很好",,,,,,,,,
vz-3GxD,cNPdcI0xT,真做得好!令西方国家的人明白新便不是他們想像的情形!,,,,,,,,,
vusOhpE,cNSB8ZxE4,Why do I want one?,,,,,,,,,
vTOfPvS,cNSFFOhcC,Wow the device is really well advanced also the video is very educative,,,,,,,,,
vytrCKr,cNT1uvuPP,Lo probé en mi último viaje a Japón y fue increíblemente preciso. Aunque sería genial si tuviera una batería más duradera.,,,,,,,,,
vb-Daa_,cNTQzQUZC,"I used the Xfaiyx Smart Translator during my visit to Vigo’s Christmas markets, and it was great for simple phrases but struggled with slang.",,,,,,,,,
vhIxU0L,cNTvwP9aM,I am a chick in a toilet,,,,,,,,,
v-ox8Uw,cNU6gpNS4,"Ich habe es auf meiner letzten Reise nach Spanien benutzt, und es hat super funktioniert! globe showing Europe-Africa thumbs up",,,,,,,,,
vlbVrtw,cNV8TzY7G,今度は焼き鳥でございますか。 仲のよろしいご家族で。 晴天に一点の雲もなしってとこかな。 10年ほど前、BMW本社のあるオリンピック公園駅の タバコ吸い殻が凄かったこと、なぜか浮かんできました。 ちなみに小生BMW乗り回しております。,,,,,,,,,
vTOfPvS,cNVBt4MzI,"I'm really tempted to buy the Xfaiyx Smart Recorder after watching this video. For only $199.99, it offers impressive value and seems perfect for recording on the go. I appreciate the detailed review and demonstration provided. thanks man",,,,,,,,,
v4Htv2Q,cNWP7AF05,"I used this translator in Beijing, and it was decent for basic phrases. However, it struggled with complex sentences.",,,,,,,,,
vKJ2vqX,cNXLUdpek,Happy birthday party popper,,,,,,,,,
vb-Daa_,cNXsrdREV,Koda is so adorable !,,,,,,,,,
vcU7cYQ,cNXuilQH3,"I’ve been using Xfaiyx Smart Translator during my recent trip to Japan, and it worked flawlessly for real-time conversations. Highly recommend it over Google Translate!",,,,,,,,,
vgIr-dG,cNY7xHUFG,喜欢你们两个人。 男人对陌生环境有非常大的探索心。 女人每天快乐的不得了。到了吃饭时间总是由她来点菜。每次吃的都是不亦乐乎。 哈哈 grinning face with smiling eyes 希望你们花上4~5年时间把全中国都走一遍!,,,,,,,,,
vlbVrtw,cNZjc8U-p,レナママがなにより、最高なんだ smiling face with smiling eyes 観ていて、幸せになれる!,,,,,,,,,
vJOK_jc,cN_qpbpz0,"I bought this recorder for my immigration process, but it stopped working after a month. Very disappointed.",,,,,,,,,
vz-3GxD,cNaDyKpMX,"老币是海外博主中为数不多真正用心去推广中国文化的人,感谢! smiling face with smiling eyes",,,,,,,,,
vgmyU_t,cNa_HhIKq,Does it have ChatGPT build in,,,,,,,,,
vjqfJjv,cNazXB5wK,The voice recognition seems to struggle with accents. I hope they improve this feature in future versions.,,,,,,,,,
vhLcap1,cNbJA7WHX,This looks like a great device for traveling abroad! I wonder how accurate it is with slang or regional dialects?,,,,,,,,,
vdbLgWS,cNdMKDfZX,This is great Liz & Atti. Love two hearts you guys loads. God bless. Grandma from Nigeria.,,,,,,,,,
v95aInR,cNeSzNRAo,"Używałem Xfaiyx Translator podczas nurkowania w Morzu Czerwonym, aby komunikować się z lokalnymi przewodnikami. Działał świetnie!",,,,,,,,,
vOU2rJb,cNgGQxq3B,"Your commentary is engaging and informative, making this review a pleasure to watch and learn from.",,,,,,,,,
vIiTZO1,cNgbnurUk,Hi smiling face with hearts,,,,,,,,,
vRoMHNQ,cNh5A5Mof,黒豚と島津と言えばかごんま(鹿児島)かな...,,,,,,,,,
vMULQIS,cNjUV7zfi,First,,,,,,,,,
vOqoEVw,cNkXMtcD6,"Pensateci bene,il corrimano in vetro bellissimo ma pulirlo non è semplice.",,,,,,,,,
vmsHv2Z,cNlQz7uBV,Gangnam style isn’t Chinese skull,,,,,,,,,
v7lX8Ro,cNlTI1iDR,Great battery life—perfect for long meetings or conferences.,,,,,,,,,
vB0lLSM,cNlcMMxeG,案件...だと?!,,,,,,,,,
vB0lLSM,cNlfbSlOC,とっても美味しそう! 今回注文したメニューをよかったら概要欄に教えてもらえたら同じの頼みたいです!,,,,,,,,,
vgIr-dG,cNpHNcfHj,party popper party popper party popper party popper party popper party popper red heart red heart red heart,,,,,,,,,
vIiTZO1,cNpbtQ_Iv,This video is so good smiling face with hearts,,,,,,,,,
vIiTZO1,cNqWVnG7H,face with tears of joy face with tears of joy face with tears of joy,,,,,,,,,
vIiTZO1,cNqb8sOrs,smiling face with hearts smiling face with hearts smiling face with hearts,,,,,,,,,
v4wSOpe,cNsuqrLOE,I took it on a trip and loved how easy it was to record and transcribe conversations without needing Wi-Fi.,,,,,,,,,
vIiTZO1,cNtBz5Jf_,Simply fantastic!,,,,,,,,,
vgIr-dG,cNtMMDWFE,Welcome back party popper,,,,,,,,,
vlbVrtw,cNvxi_jtW,パパ可愛すぎる face with tears of joy,,,,,,,,,
v0nP_KB,cNxbIvia7,Too expensive for me.,,,,,,,,,
vHahKrc,cNyaQF0G9,性能がすごいって聞いたけど、実際に使った人のレビューをもっと見たい。,,,,,,,,,
vdbLgWS,cO6N6QR36,I need this too,,,,,,,,,
v7lX8Ro,cO6rL0ld8,Clear sound up to 10 meters? Ideal for group discussions.,,,,,,,,,
v4wSOpe,cO7BtGTgj,it has Romanian?,,,,,,,,,
vOqoEVw,cO7XefJtP,"Non è male, ma ho notato che alcune lingue hanno traduzioni meno accurate rispetto ad altre.",,,,,,,,,
vZBnD1J,cO8BI5k6z,just download deepl at this point,,,,,,,,,
v-ox8Uw,cO8OzIwJH,Mein Samsung hat es,,,,,,,,,
v-ox8Uw,cO8P4FkHI,"Ich habe es für meine Reise nach Asien gekauft, und es war ein echter Lebensretter! globe showing Asia-Australia",,,,,,,,,
v-ox8Uw,cO8RtqLsX,Ich finde den Preis etwas hoch für ein Übersetzungsgerät. confused face,,,,,,,,,
vIiTZO1,cO9SjNKrh,"I bought this for my online classes, and it’s been a lifesaver! raising hands",,,,,,,,,
vJAQbN9,cOE_xs_VW,Ich Reise jeden Winter 5 Monate durch die Welt. Nutze für Übersetzung das Handy. Google oder DeepL reichen da vollkommen. In der tiefsten walachei damit klargekommen. Das Ding lohnt net. Meine Meinung,,,,,,,,,
vMULQIS,cOGj48U3D,Two times,,,,,,,,,
vdbLgWS,cOHJkPWXS,"This translator is amazing! I used it during my trip to Japan, and it made communication so much easier. Highly recommend it for travelers! smiling face with smiling eyes",,,,,,,,,
vgIr-dG,cOHbKnxWW,"碟子是装醋和放点辣椒,在用包子粘着吃",,,,,,,,,
vIiTZO1,cOHtVDEe1,face with tears of joy face with tears of joy face with tears of joy,,,,,,,,,
v3-vK-4,cOK2-BK_w,"L'ho usato per chiedere indicazioni in Cina, ma alcune traduzioni erano confuse. È comunque meglio di niente.",,,,,,,,,
vJAQbN9,cOKFVFsMg,du weißt schon das es ein Android Gerät ist und nichts anderes als ne Übersetzungs App face with tears of joy also ein überteuertes Android Handy ohne Funktion,,,,,,,,,
vgIr-dG,cOLPcXaaj,"這是小包子,不是餃子",,,,,,,,,
vnK5t9y,cONrsu4D6,値段によるけどこれは本当にいいですね。 翻訳機に頼り切りになってしまう危険性はちょっと怖いです。,,,,,,,,,
vgIr-dG,cOPG8-0ib,"Welcome back to China, I like your videos very much and thank you very much for improving my English listening skills. Have a nice trip! smiling face with hearts",,,,,,,,,
vjEBu9W,cOPNNyMMC,"Does the Xfaiyx Smart Translator support offline mode? It would be super helpful when traveling to areas without stable internet, like some parts of Geylang Serai.",,,,,,,,,
vytrCKr,cOPlwwnB_,Con el samsung ia te traducen igual sin tener que comprar eso,,,,,,,,,
vdKeRm9,cOQp_ENWB,Mit Ner helix wäre es nicht passiert,,,,,,,,,
vz-3GxD,cORHEvSm6,"我也要为你鼓掌!!!你每一部作品都是用尽的心思,是真的在宣传中国文化和美景。而不是像那些会中文的老外发些东西不过是为了赚流量罢了。再次感谢你!",,,,,,,,,
v129LuD,cORM-IGfj,enjoyable.lifeeas,,,,,,,,,
vIiTZO1,cORT-L4w-,Hi,,,,,,,,,
vJOK_jc,cOSxw_I7f,hi - what we have ECA in masters . still we can apply,,,,,,,,,
vyTFg05,cOTru-aZp,Nice vlog.. Ap apny maiky nhi gaen anwari?,,,,,,,,,
vgIr-dG,cOWcJS7LJ,"Great, when you are in Qingdao, don't forget to eat seafood and drink Qingdao beer smiling face with smiling eyes",,,,,,,,,
vJAQbN9,cOXCgyy5N,kannst du mir einen vergleich machen mit den Google Übersetzer und den teil,,,,,,,,,
vyumcj7,cOXLZaVaZ,Or just use Samsung buds3 pro with built in translation,,,,,,,,,
vJOK_jc,cOXMJQbVU,"I recently used the Xfaiyx Smart Recorder during my immigration consultation, and it was amazing to have everything transcribed automatically. Highly recommend!",,,,,,,,,
v2cabia,cOXmU8XDQ,Hey it's ok to take time I understand it's hard and we are proud of you and will support you as always,,,,,,,,,
vdbLgWS,cOZDNn7Dp,Perfect for an intercultural family as yours,,,,,,,,,
vlbVrtw,cO_W36_P3,オカン、いつもオシャレね,,,,,,,,,
vgIr-dG,cO_sWYpSc,The Xfaiyx Smart Translator is perfect for travelers! I used it to explore Shandong's cultural heritage without any language barriers.,,,,,,,,,
vmsHv2Z,cOa6KWu96,The audio quality reminds me of my sister's old cassette recorder from the 80s... not impressed.,,,,,,,,,
vJAQbN9,cOc2eUrF4,Oder in Asiatischen Nagelstudios. Bestimmt interessant face with tears of joy face with tears of joy face with tears of joy,,,,,,,,,
vz-3GxD,cOc3Bf0jr,"你好, 我是台灣人 也是中國人 你對中國正向宣傳的努力,讓我非常感動也非常感謝 red heart heart suit",,,,,,,,,
vIiTZO1,cOcPHQM1A,I love u pleading face pleading face,,,,,,,,,
vMSQja0,cOcoJ3fMv,"5:35 That's Horchata drink, made with rice, milk, vanilla, cinnamon and water.",,,,,,,,,
vJOK_jc,cOduMn_d5,"Sandy I see all your videos and like u alot,i can't relate you with my daughter if u don't mind,can u please tell how u selected your life partner ,which things u or ur family prioritise while searching As I am a mother, my daughter is in canada and she wants me to select the life partner for her,she is scared of frauds That will be a great help .",,,,,,,,,
vgIr-dG,cOfx6HXJA,欢迎回来hh~~~,,,,,,,,,
vmsHv2Z,cOjUKc996,Can you use this for interviews outdoors without background noise ruining the recording?,,,,,,,,,
vgIr-dG,cOkRtnKpQ,miss u guys so much!,,,,,,,,,
vjEBu9W,cOkU_pUrT,10 sticks of satay for 16 dollars is a complete scam. I don't even think the ones at satay by the bay are that expensive,,,,,,,,,
vc_of-A,cOmp4uC3p,Lapporta c’est un aventurier il joue avec nos sentiments,,,,,,,,,
vIiTZO1,cOoMbNNjT,beaming face with smiling eyes beaming face with smiling eyes beaming face with smiling eyes,,,,,,,,,
v5cquLT,cOogsT1HT,"Russian is also attractive, but does this translator handle complex grammar well?",,,,,,,,,
vIUVexk,cOqhNeSve,"No sé, creo que Google Translate hace lo mismo y además es gratis. thinking face",,,,,,,,,
vgIr-dG,cOsZCbj6G,red heart clapping hands light skin tone clapping hands light skin tone clapping hands light skin tone thumbs up thumbs up thumbs up party popper party popper party popper party popper,,,,,,,,,
vgXp8qe,cOuHj9Alt,"earlyyyy, ily Aster face blowing a kiss",,,,,,,,,
vMSQja0,cOwClF9Ed,"翻譯機很實用,做視頻紀錄生活兼帶貨,很棒 thumbs up ,別理會一些網友的差評,加油!",,,,,,,,,
vMSQja0,cOwKPDg1M,不可思议,,,,,,,,,
vgIr-dG,cOwWxoNjw,We definitely missed you guys in China. Wasn’t too interested in Cambodia!! Looking forward to a long China innings.......,,,,,,,,,
vyTFg05,cOw_QuE1z,Beautiful location Nice sharing,,,,,,,,,
vhLcap1,cOxRqgeDP,Nice. But I hope future versions include support for translating regional languages like Swahili or Tamil.,,,,,,,,,
vyTFg05,cOyDvwOY0,red heart red heart red heart red heart red heart,,,,,,,,,
vz-3GxD,cOzmimXm9,好有頭腦 party popper 這種方式介紹中國新疆 和 分享中國美食 thumbs up face savoring food,,,,,,,,,
vZBnD1J,cP-5MhChe,what happens after2 years,,,,,,,,,
v4Htv2Q,cP09iz7c2,"Actually they have wearable smart glasses in China that does real time translating, both verbal and visual, babel fish is real~",,,,,,,,,
vgIr-dG,cP0NxLFaM,Can drink beer from plastic bags,,,,,,,,,
vz0DmiM,cP17a-7Yr,It shows that this device is designed with versatility in mind.,,,,,,,,,
vIiTZO1,cP1a0wBlF,Gfn smirking face smirking face,,,,,,,,,
vlbVrtw,cP1wIFsuo,良い機械だなぁ、買おうかな。,,,,,,,,,
vIiTZO1,cP3SFnlqb,face with tears of joy face with tears of joy face with tears of joy,,,,,,,,,
vgIr-dG,cP4RMCxVZ,nice beaches available in Shenzhen Dapeng crystal blue sea,,,,,,,,,
vKJ2vqX,cP5QfKlzL,Amazing gift bro it also help us to understand polish language. grinning face with big eyes,,,,,,,,,
vmsHv2Z,cP5gjm6we,how do I get it please,,,,,,,,,
v95aInR,cP6Wk-rCc,W Aleksandrii z tego co widzę nie ma takich temperatur latem,,,,,,,,,
vgIr-dG,cP9LpCOmx,"So happy to see that you comeback to China party popper Give u two tips u can put the chilly sauce into the other sauce, then mix them. 2. If u want to seek the booth of QingDao beer, the faucet with a green tag is real beer. Sorry for my English grammar,I am working hard on it. smiling face with smiling eyes looking forward to your next video.",,,,,,,,,
vc_of-A,cP9Q8J3PR,"@fcbarcelona we Want Kimmich, nico",,,,,,,,,
vlbVrtw,cPA2XA_WF,両親に先に食べさせるのでなく、自分が先に食べるのがいいね。,,,,,,,,,
vhLcap1,cPBWgYcOL,Not fast enough,,,,,,,,,
vr_LT5A,cPBjXi3e0,不知道這款錄音筆是否支援即時播放錄音內容?,,,,,,,,,
vRoMHNQ,cPBqDBV8G,日本の文化を学ぶためにXfaiyx Smart Translatorを使っています。特に歴史的な場所での説明を理解するのに役立ちます!,,,,,,,,,
vz-3GxD,cPDWig8zb,"欢迎来新疆,欢迎来中国!作为一个长期生活在长江边的中国人,第一次因为工作原因去新疆的时候,我的内心其实是忐忑不安的。到了新疆之后,我就爱上这个地方了!很骄傲我曾经为新疆做了一些事情!",,,,,,,,,
vIiTZO1,cPHxGjb45,smiling face with hearts smiling face with hearts smiling face with hearts,,,,,,,,,
vgIr-dG,cPINFxXHu,Haven’t go to Qingdao yet you are professional smiling face with smiling eyes,,,,,,,,,
vZNFtEb,cPIgOgiCJ,와 저런 번역기가 있었다니 역시 비싸군요 ᄏᄏᄏ 하지만 성능은 확실하네요,,,,,,,,,
vUfYwzN,cPJZHjpG_,"The interface is user-friendly, but I think adding a touchscreen option would make navigation even smoother.",,,,,,,,,
vgIr-dG,cPKcJFT5F,I'm in Nepal for the next 5 months. I arrived 5 days ago and I can't wait to get travelling. China is definitely on my list for the future.,,,,,,,,,
vgIr-dG,cPLaTAaP6,Wow! the dumplings look yummy. An amazing video clip from the lovely couple. Thanks for sharing this clip. Looking forward to more clips from both of you. Have a pleasant trip. Best regards clinking beer mugs folded hands,,,,,,,,,
v95aInR,cPPuH9KKC,A jak nazywa sie ten apartamentowiec ? i gdzie sie znajduje ?,,,,,,,,,
vnK5t9y,cPRAYnXIn,デイアナさん私(日本語分かりません)困りましたネ face with tears of joy,,,,,,,,,
vZNFtEb,cPRwP9pDK,요 번역기 진짜 좋은데요. 진짜 영어 안 통하는 곳에서도 걱정 없이 여행할 수 있겠어요. ᄒᄒ,,,,,,,,,
vMSQja0,cPUgvuqP0,Happy birthday Ross party popper red heart,,,,,,,,,
v2cabia,cPUt9TvNS,"The design of the Xfaiyx Smart Recorder is sleek, but I wish it had a longer battery life for extended use during trips.",,,,,,,,,
vzFysYU,cPVs4ef2P,旅行中にXfaiyx Smart Translatorを使ったおかげで、地元の人と楽しく会話できました!買ってよかったです。,,,,,,,,,
vwm_9ft,cPXg7d77A,"Sorry, but the design feels bulky compared to other recorders I’ve used. confused face",,,,,,,,,
vUG_xbR,cPZXtAcnA,Amazing video! The translator gadget caught my eye. Where can I buy it?,,,,,,,,,
vc_of-A,cPZiW0kBO,thumbs up thumbs up thumbs up,,,,,,,,,
vc_of-A,cP_800B0S,face with tears of joy face with tears of joy face with tears of joy face with tears of joy,,,,,,,,,
v3-vK-4,cPae8GW4f,"30:52 non ho capito , porti la carta igienica perché fa cagaà?",,,,,,,,,
v95aInR,cPbN7RJ7y,wszystko kwestia momentu,,,,,,,,,
vKJ2vqX,cPbbICxIs,"Love to see ur vlogs, love from Jammu red heart",,,,,,,,,
vZNFtEb,cPcii4RW4,와우~ 3번째다! 연국씨 건강히 중국여행마무리 잘하고 한국서 활동모습 기대합니다!,,,,,,,,,
vusOhpE,cPeeKceWh,Very cool party popper,,,,,,,,,
v3-vK-4,cPfnmwGxH,25:57 e mentre Nicola si appresta a trasformarsi in Super Saiyan... una sporcacciona getta una busta per terra grimacing face,,,,,,,,,
vyTFg05,cPiAaaX-7,Grandmother putting nailpolish or mesho was so great . Said it true it's just priceless,,,,,,,,,
vJAQbN9,cPja9YFlT,Also 399€ finde ich schon echt krass... Das ist dafür echt zu viel :/ Das ist nichts für jeden.. Das ist eh schon ein Nieschenprodukt und durch den krassen Preis wird das kein „Hit“,,,,,,,,,
v4wSOpe,cPm0QLKQR,It is just awesome boxing glove,,,,,,,,,
vdbLgWS,cPmMELutv,This was very enjoyable video red heart red heart red heart red heart red heart to more wins.,,,,,,,,,
v2cabia,cPmVuhZig,itne saare rice khate ho tum dinner me face with hand over mouth,,,,,,,,,
vZBnD1J,cPmgX5g1g,flushed face $600 is way too expensive for something my phone can already do.,,,,,,,,,
vyTFg05,cPmmV1-kT,Kitna peace hai yaar,,,,,,,,,
vIiTZO1,cPmuacUrj,Yeah that’s perfect for,,,,,,,,,
vMSQja0,cPoGvH187,這個翻譯軟體比谷歌翻譯的流暢精準! thumbs up,,,,,,,,,
v2cabia,cPqqWYvWR,"I tried using the Xfaiyx Smart Recorder for interviews, but the audio quality was disappointing. Not worth the price.",,,,,,,,,
vZBnD1J,cPrrCzzwd,$600 skull skull,,,,,,,,,
v5cquLT,cPsLqOJ1B,I love how portable it is! Perfect for quick translations while shopping abroad.,,,,,,,,,
vdKeRm9,cPtJ0Q_E1,"Xfaiyx kann das was jedes smartphone kann, nur kann jedes smartphone sogar noch mehr",,,,,,,,,
vyTFg05,cPtb16Xlr,red heart,,,,,,,,,
vIiTZO1,cPu7SVZ8N,grinning squinting face,,,,,,,,,
vgmyU_t,cPv53Y3JO,I’m curious if this translator supports regional accents within languages. That would be super useful for specific countries.,,,,,,,,,
vB0lLSM,cPvAVOcY4,この翻訳機、音声認識が微妙で、何度も言い直さないといけないのがストレス。,,,,,,,,,
vRoMHNQ,cPvcvWvys,しゃぶしゃぶ美味しいですよね。これからの季節あったかいお鍋系は外国人の方も日本で食べるようになるのかな? 今回も楽しかったです smiling face with smiling eyes 後日の写真入ってなかった face with open mouth red question mark,,,,,,,,,
vKJ2vqX,cPwU7YPWg,Happy B'day.. clinking beer mugs Very Smart Gift.. Pls use it..,,,,,,,,,
v3-vK-4,cPwr9FlD2,"Portami con te in Cina, favoloso! red heart",,,,,,,,,
vlbVrtw,cPx4F_OZa,Xfaiyx Smart Translatorは旅行中に大活躍しました!特にレストランで注文する時に便利でした。おすすめです!,,,,,,,,,
vjqfJjv,cPxKbGZLX,"my old french teacher used to screech at me to get out in both french and English, I used to reply ' mercy backup ' which used to enrage her even more face with tears of joy face with tears of joy",,,,,,,,,
vdbLgWS,cPyF0G_JP,Iam happy for you gal You both look great. Your hubby looks more healthier that when you were dating. You have cooked for him and also companion is important. All the best guys,,,,,,,,,
vIiTZO1,cQ-Pyo3zD,smiling face with hearts,,,,,,,,,
vgIkaeR,cQ-clo5l2,What a fun day. Except for the annoying giggling after every word said.,,,,,,,,,
vIiTZO1,cQ-lj7PTz,face with tears of joy,,,,,,,,,
vgXp8qe,cQ10NmXi8,I used this during a seminar and the audio was crystal clear! Definitely worth the investment smiling face with hearts,,,,,,,,,
vc_of-A,cQ1GDAzVW,smiling face with hearts smiling face with hearts smiling face with hearts,,,,,,,,,
vvyoPyo,cQ2yobtCy,buen dia?,,,,,,,,,
vIiTZO1,cQ4G1JBSD,Does it come with cloud storage for saving recordings? face with monocle,,,,,,,,,
vyTFg05,cQ4wacTCR,red heart red heart red heart,,,,,,,,,
vJAQbN9,cQ5_0Ci4X,"Gibt apps, die das auch leisten",,,,,,,,,
vdKeRm9,cQ5oaE8Mw,"Spoiler!: weil es jetzt schon bekannt ist, also bekannt gegeben wurde. er ist bei Manhunt dabei, Manhunt wird in Thailand ausgestrahlt",,,,,,,,,
vdbLgWS,cQ648Asj3,This is perfect you need to understand your inlaws Liz bcoz they love you so much,,,,,,,,,
v7lX8Ro,cQ6RsiiLb,Does it support external storage or just internal memory?,,,,,,,,,
vgIkaeR,cQ8mjbqQ_,Hi Nhan! :),,,,,,,,,
vMULQIS,cQA6qWI3u,"I love how easy it is to use, but the battery life could be better.",,,,,,,,,
vhIxU0L,cQCIjMTIp,1st! So funny! rolling on the floor laughing I literally know how to say where is the cinema in German grinning face with sweat The only one I know! face with tears of joy ( Wo ist das Kino ),,,,,,,,,
vc_of-A,cQCKm7o0z,Laporta comprend le français inh,,,,,,,,,
vgIr-dG,cQCpTJcYl,"事实上的夸赞和批评中国人都会欣然接受,BBC那种刻意抹黑真的很让中国人愤怒,中国人太多了, 你们会收获大量粉丝 grinning face 。",,,,,,,,,
vOqoEVw,cQDvwdeBp,"L'ho usato durante una conferenza internazionale e mi ha aiutato tantissimo, ma sarebbe meglio se avesse una batteria più duratura.",,,,,,,,,
vyTFg05,cQE_M0aTx,In which village do you live in mangalore??,,,,,,,,,
vtFQ8Km,cQEop5voo,coole nummer,,,,,,,,,
vc_of-A,cQFznDB93,red heart smiling face with hearts smiling face with hearts smiling face with hearts,,,,,,,,,
vnK5t9y,cQH1-H__r,勉強するわっ(笑),,,,,,,,,
vzFysYU,cQI2PAnGK,翻訳機能は便利ですが、音声がもう少し自然な感じになるといいですね。現状だと少しロボットっぽいです。,,,,,,,,,
vz0DmiM,cQKYbvinV,"I tried using this for podcast recording, but the sound clarity wasn't as good as I expected.",,,,,,,,,
vgIr-dG,cQM-H_D3_,You can consider immigrating to China,,,,,,,,,
vUfYwzN,cQN9an_Fd,"This smart recorder has an amazing performance, and it even supports dialect transcribing, nice.",,,,,,,,,
vUG_xbR,cQP-XkwSp,I’m really considering buying this translator. It seems to work so smoothly!,,,,,,,,,
v4wSOpe,cQP3YY4Lk,@LouisLitt,,,,,,,,,
vwK0Ro5,cQPMth-op,I have same one but not same,,,,,,,,,
vIiTZO1,cQR5sVYFD,beaming face with smiling eyes beaming face with smiling eyes beaming face with smiling eyes beaming face with smiling eyes,,,,,,,,,
v95aInR,cQRND3pQw,A co wizą? Jest tylko na 30 dni. Jak panu Mirkowi udało się tam siedzieć tyle lat?,,,,,,,,,
vhIxU0L,cQT0fbumg,I guess he really likes green cats,,,,,,,,,
vgIkaeR,cQT3s54cY,That was fun. Love the Rat.,,,,,,,,,
v3-vK-4,cQTpolq3j,Come si chiama questo mercato? (In caratteri cinesi). Ci voglio andare .,,,,,,,,,
vJAQbN9,cQUqvqI8T,Aber wo her weiß ich denn jetzt ob er das richtig übersetzt hat ??,,,,,,,,,
vyTFg05,cQUvtb9d2,Mangalore is very clean and green throughout the year. It's wonderful. Summer's can be hot. AC is a must nowadays. Being a mumbaikar I still love mangalore for it's cleanliness and greenery.,,,,,,,,,
