video_id,comment_id,comment_text,sentiment_category,user_scenario,user_question,user_suggestion,positive_cluster_theme,negative_cluster_theme,scenario_cluster_theme,question_cluster_theme,suggestion_cluster_theme
v8TdcdK,cyvmGOA3b,I want to say this again Carrie = Rocked Nick = trapped face with tears of joy face with tears of joy face with tears of joy face with tears of joy face with tears of joy face with tears of joy face with tears of joy face with tears of joy face with tears of joy,5.0,0.0,0.0,0.0,,,,,
v8TdcdK,cywALPygm,They are going to be dead meat,5.0,0.0,0.0,0.0,,,,,
vKlzOiZ,cyzw-4Z1z,ᄏᄏᄏᄏᄏ 대한민국 미래.,5.0,0.0,0.0,0.0,,,,,
vB3iY9I,cz2omrq77,Logan Paul and his stupid 10 year old fans are in for a rude awakening.,5.0,0.0,0.0,0.0,,,,,
v3T6mPl,cz6_Y89-X,"It looks cool, but I wish it had a feature to sync directly with Google Drive.",3.0,0.0,0.0,1.0,,,,,
v1hWN0s,cz7Y3IO9a,Lol now can simply use chatgpt app on phone face with tears of joy face with tears of joy face with tears of joy,2.0,0.0,0.0,0.0,,,,,
vr9Mebt,czD1QHSQ9,From Jordan Jordan I love you red heart,5.0,0.0,0.0,0.0,,,,,
vpOtjW1,czKJrVs9P,"I used the Xfaiyx Smart Translator while attending a job fair in Berlin, and it worked flawlessly! Highly recommend it for anyone looking for jobs in Germany.",1.0,1.0,0.0,0.0,,,,,
vB3iY9I,czKXjIN2-,"He doesn’t expect to win, he just wanna bankrupt him.",5.0,0.0,0.0,0.0,,,,,
ve33QLn,czQN6fcUP,"No me convenció, la traducción no siempre es precisa y a veces se traba.",2.0,0.0,0.0,0.0,,,,,
vWN5LPe,czSzbJEzq,Hi! Holly! What do you think about the Law Of Attraction concept?,5.0,0.0,0.0,0.0,,,,,
v8TdcdK,czTL28Gba,For those who don't know Niro was carrie's high school crush face with tears of joy face with tears of joy,5.0,0.0,0.0,0.0,,,,,
v1hWN0s,czTu62GAq,another item my phone can already do,2.0,0.0,0.0,0.0,,,,,
vr9Mebt,czVeDYF2V,"I love the sleek design of Xfaiyx, but the battery life is too short for long trips. Please consider improving that!",3.0,1.0,0.0,1.0,,,,,
vhTHDT-,czVyCuvlx,rolling on the floor laughing rolling on the floor laughing rolling on the floor laughing rolling on the floor laughing rolling on the floor laughing rolling on the floor laughing,5.0,0.0,0.0,0.0,,,,,
v8TdcdK,czXI6DLuE,face with tears of joy,5.0,0.0,0.0,0.0,,,,,
v8TdcdK,czZe0CEa2,Why does Carrie just confront him in the most unusual ways face with tears of joy,5.0,0.0,0.0,0.0,,,,,
vB3iY9I,czfzlhTEw,Does anyone know if Logan filing the lawsuit in Federal court is an attempt to avoid Coffeezilla's use of coffeezila's insurance policy to cover the cost of these types of lawsuits and avoid Texas anti-slaap laws?,5.0,0.0,0.0,0.0,,,,,
vUt-uCX,czh3b6pU2,Wait I thought u were tall,5.0,0.0,0.0,0.0,,,,,
vhTHDT-,czkRnA_Kk,OK hand OK hand OK hand,5.0,0.0,0.0,0.0,,,,,
v8TdcdK,czlmM4HYn,OOF no wonder why the havent posted scince yesterday,5.0,0.0,0.0,0.0,,,,,
vr9Mebt,czn2lWhoK,"Honestly, I expected better performance from Xfaiyx. It often misinterprets simple phrases like 'catch you later.'",2.0,0.0,0.0,0.0,,,,,
v1hWN0s,czph1fXpD,"I used this during a conference, and the transcription was surprisingly accurate! clapping hands",1.0,1.0,0.0,0.0,,,,,
vr9Mebt,czrYALqds,I’m disappointed with Xfaiyx. It failed to translate basic phrases correctly during my trip to the UK.,2.0,1.0,0.0,0.0,,,,,
vJUEX3u,czst9lXq6,"Mein Mann hat den Xfaiyx gekauft und nutzt ihn jetzt täglich, um seine Ideen festzuhalten. Er liebt es! smiling face with heart-eyes",1.0,1.0,0.0,0.0,,,,,
v8TdcdK,cztYiqe5A,BAHAHAHAHAHAHAHAHAHAHAHAHAHAAHHAHAAH face with tears of joy face with tears of joy face with tears of joy face with tears of joy face with tears of joy face with tears of joy grinning face with sweat grinning face with sweat grinning face with sweat grinning face with sweat,5.0,0.0,0.0,0.0,,,,,
v8TdcdK,czw5ZcNwJ,When you get merry dear friends party popper face with tears of joy,5.0,0.0,0.0,0.0,,,,,
v1hWN0s,c-SVLcEVq,€ ?,1.0,0.0,0.0,0.0,,,,,
v1hWN0s,c09debm_Z,Louis litt ahhh dictaphone,5.0,0.0,0.0,0.0,,,,,
v9edfKB,c0An5vU1P,"Ich finde die Idee eines integrierten SIM-Karten-Systems interessant, aber ich frage mich, ob es wirklich notwendig ist, wenn man ohnehin WLAN nutzen kann.",3.0,0.0,1.0,0.0,,,,,
vpOtjW1,c0i7HXBuK,I think the translator should have an option to customize voice speed for better clarity during fast-paced conversations.,2.0,0.0,0.0,1.0,,,,,
vbesCCb,c10P8Inp9,Ist das Gerät wasserdicht? Wäre wichtig für Outdoor-Reisen.,4.0,1.0,1.0,0.0,,,,,
viVgLsZ,c1N_cwqCk,Wtf 30 Kontinente????!!! face with tears of joy face with tears of joy face with tears of joy face with tears of joy,5.0,0.0,0.0,0.0,,,,,
vpOtjW1,c1UNPZiGc,This translator could be a lifesaver for foreigners applying for jobs in Germany. Does it include a dictionary feature for learning new words?,1.0,1.0,1.0,0.0,,,,,
vWN5LPe,c2JN6mShe,I wonder if the Xfaiyx Smart Translator can translate idiomatic expressions accurately? That would be super useful for my job.,4.0,1.0,1.0,0.0,,,,,
viVgLsZ,c2Q8kmWqV,"Die Sprachenvielfalt ist beeindruckend, aber ich finde die Übersetzungsqualität bei komplexen Sätzen nicht ausreichend.",3.0,0.0,0.0,0.0,,,,,
v1hWN0s,c2c1y2Vd8,There’s an app for that.,2.0,0.0,0.0,0.0,,,,,
vbesCCb,c2d0cBbDV,"Ich habe es getestet, aber die Übersetzungen waren nicht immer korrekt. Für den Preis hätte ich mehr erwartet.",2.0,0.0,0.0,0.0,,,,,
vbesCCb,c2rPwUS2j,leider fast 370€ aber dat Ding sieht sehr benutzbar und nützlich aus wenn man viel reist,3.0,1.0,0.0,0.0,,,,,
v8TdcdK,c2tfzlwu0,Not good.,2.0,0.0,0.0,0.0,,,,,
vQjtjf2,c2zidFhkw,¿Tiene soporte para traducción instantánea en chats? Esto sería ideal para comunicación remota.,4.0,1.0,1.0,0.0,,,,,
vQjtjf2,c32CejYDn,"de acá a 10 años estarán en los Smartphone teléfonos, como pasó los GPS garmin , iguales lento todavía el producto en pantalla",2.0,0.0,0.0,0.0,,,,,
v1hWN0s,c3Bp5283w,"74,677,836,685$ tho",5.0,0.0,0.0,0.0,,,,,
v8TdcdK,c3kCdCGxp,Google translate be like crying face,2.0,0.0,0.0,0.0,,,,,
v8TdcdK,c3lRO5tEq,Duolingo?,5.0,0.0,0.0,0.0,,,,,
vmCnKGQ,c41-9cFmw,I'm curious about the durability. How does it hold up with daily use?,4.0,1.0,1.0,0.0,,,,,
v4g6avX,c4gDwMF3V,Would be great if it could translate handwritten text too! light bulb,1.0,0.0,0.0,1.0,,,,,
v1hWN0s,c5Uz93Hwg,lovely,5.0,0.0,0.0,0.0,,,,,
viVgLsZ,c5fVHMPMX,"Der Typ muss unbedingt mal zum Arzt face with tears of joy Aber ernsthaft, braucht man wirklich einen separaten Übersetzer heutzutage?",2.0,0.0,0.0,0.0,,,,,
viVgLsZ,c5h-i5c5D,Warum sollte man sowas brauchen? Ein Handy mit einem Übersetzer reicht doch aus!,2.0,0.0,1.0,0.0,,,,,
v8TdcdK,c62WK-jmI,So I am still safe from that translator face with tears of joy face with tears of joy face with tears of joy because the language I spoken is not listed there.,2.0,0.0,0.0,0.0,,,,,
vTdqmte,c6kU1nKA6,"The Xfaiyx Smart Translator seems like a great tool for van life, especially when traveling to remote areas with language barriers. Has anyone tried it in off-grid situations?",1.0,1.0,1.0,0.0,,,,,
vUt-uCX,c7FwZE3l4,Bro is not even up to 4.5 pleading face pleading face,2.0,0.0,0.0,0.0,,,,,
vJUEX3u,c7xca83yN,"Ich mag das Design des Xfaiyx, aber es wäre toll, wenn es leichter wäre. Es fühlt sich etwas schwer an für unterwegs.",3.0,0.0,0.0,1.0,,,,,
v8TdcdK,c82ir-z8r,Why does the device require an internet connection for most features? Isn't there an offline option?,2.0,0.0,1.0,1.0,,,,,
v1hWN0s,c8mzj_TDm,my phone does the same thg,2.0,0.0,0.0,0.0,,,,,
v4g6avX,c8vwH9PCj,smart!,1.0,0.0,0.0,0.0,,,,,
v1hWN0s,c8zg1EvMi,I was just about to buy one when I Googled it on my S23 Ultra face with raised eyebrow,2.0,0.0,0.0,0.0,,,,,
v8TdcdK,c8zqKWqSU,Omggg there was Slovak i am from Slovakia,1.0,0.0,0.0,0.0,,,,,
vb-WyHa,c94rIakrq,Can I use it to translate text from images or signs?,4.0,0.0,1.0,0.0,,,,,
v4g6avX,c9CzlGaAw,"The design is sleek, but I wish it was waterproof for outdoor adventures. light bulb",3.0,1.0,0.0,1.0,,,,,
viVgLsZ,c9PLfsxOl,Schafft das heutige s24 genauso sogar bei Telefonaten,2.0,0.0,0.0,0.0,,,,,
v1hWN0s,c9cov3HSk,aliexpress ?,5.0,0.0,0.0,0.0,,,,,
v1hWN0s,c9iB8XUW9,my phone already does that face with tears of joy,2.0,0.0,0.0,0.0,,,,,
vmCnKGQ,cA1n4GWXu,Is there a companion app for smartphones? That would be convenient for managing recordings. thumbs up,2.0,0.0,1.0,1.0,,,,,
vb-WyHa,cA3Utcn4b,Amazing fire fire fire,1.0,0.0,0.0,0.0,,,,,
v9edfKB,cABRZQU-v,"Der Preis des Geräts ist ziemlich hoch im Vergleich zu anderen Übersetzern auf dem Markt. Gibt es eine Möglichkeit, Rabatt zu bekommen?",2.0,0.0,1.0,0.0,,,,,
vmCnKGQ,cAFRLVXpH,I like the idea of a smart recorder. How responsive is the voice recognition?,1.0,0.0,1.0,0.0,,,,,
vB3iY9I,cAYAOME2p,"I was excited to try the Xfaiyx Smart Recorder, but the battery life is disappointing. It barely lasts through a full day of recording.",2.0,0.0,0.0,1.0,,,,,
vhTHDT-,cBNtJn447,I wonder if the Xfaiyx Translator works offline? Would be super helpful for travel!,4.0,1.0,1.0,0.0,,,,,
vr9Mebt,cByJmC7-n,Can this translator help with pronunciation practice? I want to sound more like a native speaker.,4.0,1.0,1.0,0.0,,,,,
vb-WyHa,cC0I2abVr,i can use my normal phone expressionless face,2.0,0.0,0.0,0.0,,,,,
vhTHDT-,cChJtLugp,"I tried it for translating French and it worked fine, but struggled with idioms.",3.0,0.0,0.0,0.0,,,,,
v9edfKB,cCoLlfSli,من المضحك أن لديك مترجمًا يمكنه,5.0,0.0,0.0,0.0,,,,,
v3T6mPl,cD996fa-w,Haha what’s the point?!,2.0,0.0,0.0,0.0,,,,,
vTdqmte,cDSFF5Oj2,Does the Xfaiyx Smart Translator work offline? That would be super helpful for van life adventures where internet isn't always available.,4.0,1.0,1.0,0.0,,,,,
vmCnKGQ,cEVhbA41M,"Is the audio quality clear, even in noisy environments?",4.0,0.0,1.0,0.0,,,,,
vhTHDT-,cEa94mtbK,Does it have a feature to save frequently used phrases? That would be super handy.,4.0,0.0,1.0,1.0,,,,,
v4g6avX,cEf8ia_4f,smiling face with hearts smiling face with hearts smiling face with hearts,5.0,0.0,0.0,0.0,,,,,
vWN5LPe,cEiBokSrD,"I tried using the Xfaiyx Smart Translator during a virtual meeting, but the audio quality wasn’t great. Hope they improve this in future versions.",2.0,1.0,0.0,1.0,,,,,
v1hWN0s,cEvdMacum,This just for noisy people want to leave device hidden to hear your comvos lol,4.0,1.0,0.0,0.0,,,,,
vJUEX3u,cF-QXi4uZ,"Ich finde den Xfaiyx praktisch, aber manchmal reagiert er nicht sofort auf Sprachbefehle. Hoffentlich wird das in zukünftigen Updates verbessert.",3.0,0.0,0.0,1.0,,,,,
vKlzOiZ,cF-eUNKvw,이 제품은 튀르키예 같은 다국어 환경에서 정말 유용할 것 같아요. 하지만 가격이 조금 부담스럽네요.,3.0,0.0,0.0,0.0,,,,,
v8TdcdK,cFk2od3Ai,"The Xfaiyx Translator is great for casual use, but I wish it had more professional-grade features.",3.0,0.0,0.0,1.0,,,,,
v1hWN0s,cFlO-SExv,Hope they add support for more dialects in future updates.,4.0,0.0,0.0,1.0,,,,,
v1hWN0s,cG5bbiCpU,given us something that's already been around,2.0,0.0,0.0,0.0,,,,,
vbesCCb,cG6AcINUt,369€ ist ja ein Schnäppchen see-no-evil monkey,1.0,0.0,0.0,0.0,,,,,
vbesCCb,cG8F7J3m0,es benötigt aber Internet,2.0,0.0,0.0,0.0,,,,,
v1hWN0s,cGAvr0igD,so a phone,2.0,0.0,0.0,0.0,,,,,
v8TdcdK,cGtdscRTO,12%baterie only,2.0,0.0,0.0,0.0,,,,,
v9edfKB,cH2tbVm_r,Ich brauche eigentlich nur Deutsch-Rumänisch für meinen Schwiegervater. Gibt es eine günstigere Version ohne Internetfunktion?,4.0,0.0,1.0,0.0,,,,,
vTdqmte,cHHr3sZg-,Can the Xfaiyx Smart Translator handle regional dialects or slang? That would be amazing for connecting with locals during van life travels.,4.0,1.0,1.0,0.0,,,,,
vpOtjW1,cHJHc9L7a,I’m considering buying the Xfaiyx Smart Translator for my upcoming move to Germany. Is it compatible with Bluetooth headphones?,1.0,0.0,1.0,0.0,,,,,
v3T6mPl,cH_UU9jo5,I buy so a phone Or just a phone AiPod how much,5.0,0.0,0.0,0.0,,,,,
vB3iY9I,cHoZX_ewf,The Xfaiyx Smart Recorder looks like a great tool for recording interviews or legal consultations. Has anyone tried it for professional use?,4.0,1.0,1.0,0.0,,,,,
vTdqmte,cIH4YL7wA,I wouldn’t recommend the Xfaiyx Smart Translator for long-term travel. It feels flimsy and doesn’t seem built to last.,2.0,1.0,0.0,0.0,,,,,
vbesCCb,cJ2GZXfwa,Eine Wanze mehr.,4.0,0.0,0.0,0.0,,,,,
v1hWN0s,cJ882jsj9,Ohhh i thought it's a Walkman,4.0,0.0,0.0,0.0,,,,,
viVgLsZ,cJSrmXZjn,Ja alles klar für 369€ reicht mir mein Smartphone definitiv aus!!,2.0,0.0,0.0,0.0,,,,,
v3T6mPl,cJX-9AbSk,"When it comes to capturing important information, I always recommend transcribethis io. It's helped me keep everything organized and easy to refer back to whenever I need to.",2.0,0.0,0.0,0.0,,,,,
vhTHDT-,cJXyoOeN6,"I tried it for a school project and it was okay, but struggled with technical terms.",3.0,1.0,0.0,0.0,,,,,
v1hWN0s,cKCWkKFP-,So it has the same application idea as what phones can do already? Why not use an existing phone for these...,4.0,0.0,1.0,0.0,,,,,
v8TdcdK,cKDx_HVNK,Product link,1.0,0.0,1.0,0.0,,,,,
v4g6avX,cKKBnWXcf,Wish it had a longer battery life. It dies too quickly during long trips. confused face,2.0,1.0,0.0,1.0,,,,,
vbesCCb,cKKap9UCr,kann mein Smartphone auch,2.0,0.0,0.0,0.0,,,,,
vB3iY9I,cKX4tLEkH,"that xfaiyx thing is not worth 349.99 CAD, that's outrageous i can get an Xbox for that price, good video tho",2.0,0.0,0.0,0.0,,,,,
v9edfKB,cK_zt8340,"Ich brauche eigentlich nur Deutsch - Rumänisch für den Schwiegervater. Gibt's den dann um € 99,- ? Der braucht auch kein Internet - eigentlich nur ein Stationäres Gerät ohne Schnickschnack. Nur zum einfachen Verwenden mit der Rumänischen Pflegerin",4.0,1.0,1.0,0.0,,,,,
v1hWN0s,cKbZ34KDD,isn't this an app? Pixel phone have this,2.0,0.0,1.0,0.0,,,,,
vmCnKGQ,cKiUVf1c6,"The compact design is great, but I found the touchscreen a bit unresponsive at times.",3.0,0.0,0.0,0.0,,,,,
v8TdcdK,cKvBJPkgW,Simply u could have used Google translator right.,2.0,0.0,0.0,0.0,,,,,
v3T6mPl,cL47c2_gY,"When it comes to capturing important information, I always recommend transcribethis io. It's helped me keep everything organized and easy to refer back to whenever I need to.",2.0,0.0,0.0,0.0,,,,,
v9edfKB,cL7-NU9qx,Endlich mal gepflegte Hände. Ich wollte mir mal einen Translator bei Ali- Express bestellen. Da waren die aber längst nicht so teuer. Die laufen auch mit Android.,2.0,0.0,0.0,0.0,,,,,
vQjtjf2,cLN_-Fxv3,¿Este traductor funciona sin conexión a internet? Sería muy útil para viajes.,4.0,1.0,1.0,0.0,,,,,
v9edfKB,cLfWROryA,"SHy dorasti ? chrubi ?... persisch ist sehr allgemein ... dari, farsi , pashto, tajik usw",5.0,0.0,0.0,0.0,,,,,
v3T6mPl,cM6eFvm03,my phone already does that ????,2.0,0.0,0.0,0.0,,,,,
vhTHDT-,cMNfEVv1W,HELPPP smiling cat with heart-eyes fire fire SMART,1.0,0.0,0.0,0.0,,,,,
v8TdcdK,cMQhf20r-,There is something called google translator on your phone,2.0,0.0,0.0,0.0,,,,,
ve33QLn,cMowwB3hr,¿Es compatible con auriculares Bluetooth? Sería más cómodo usarlo así.,4.0,0.0,1.0,0.0,,,,,
vpOtjW1,cMrgCf37h,Get ready for Amazon Prime Day on July 16th and 17th! Grab the Xfaiyx Smart Translator for just £319. Visit link and save an extra £20 with BUDDYPRO. Would you prefer their website? Visit link and use KOLSpecial for the same great discount. Don't miss out,1.0,0.0,0.0,0.0,,,,,
v9edfKB,cNCJ4c-B8,"Der Xfaiyx Übersetzer sieht gut aus, aber ich frage mich, ob er auch offline funktioniert? Das wäre für mich ein entscheidender Punkt.",1.0,0.0,1.0,0.0,,,,,
v9edfKB,cNFC3c3OL,"Ich habe den Xfaiyx Übersetzer ausprobiert, und er ist wirklich nützlich für schnelle Übersetzungen. Allerdings wäre eine robustere Bauweise wünschenswert.",3.0,0.0,0.0,1.0,,,,,
v1hWN0s,cNsPuPSkG,"Super cool device, but how is this different from a regular dictaphone?",3.0,0.0,1.0,0.0,,,,,
v1hWN0s,cNtL0c7LB,There's an app for that,2.0,0.0,0.0,0.0,,,,,
v8TdcdK,cOhAhRkD3,Bengail i saw it my language,4.0,0.0,0.0,0.0,,,,,
vmCnKGQ,cOrAKOD5f,Does it come with cloud storage options? Would love to sync my recordings easily.,1.0,0.0,1.0,1.0,,,,,
vmCnKGQ,cP9vWw7sJ,I wish the battery life was longer. It barely lasts a full day of recording.,2.0,0.0,0.0,1.0,,,,,
vpOtjW1,cPDOw8eet,"The Xfaiyx Smart Translator is perfect for casual conversations, but I wish it had a feature to save frequently used phrases for quick access.",3.0,1.0,0.0,1.0,,,,,
v9edfKB,cPDwT9dXV,"Ich frage mich, ob der Xfaiyx Übersetzer auch für medizinische Fachbegriffe geeignet ist? Das wäre für meinen Beruf sehr hilfreich.",4.0,1.0,1.0,0.0,,,,,
v8TdcdK,cPFquZ9Xl,Carrier you could have used Google translator face with tears of joy,2.0,0.0,0.0,0.0,,,,,
vKlzOiZ,cPhUUOjeR,"Xfaiyx Smart Translator는 튀르키예 같은 다국어 환경에서 정말 유용할 것 같지만, 배터리 지속 시간이 짧다는 점이 아쉽습니다.",3.0,0.0,0.0,1.0,,,,,
vB3iY9I,cQ2KfUmy_,Is the Xfaiyx Smart Recorder compatible with MacOS? I'm considering it for editing audio files on my laptop.,1.0,0.0,1.0,0.0,,,,,
v8TdcdK,cQAeXIJ3H,TELL ME THE APP,1.0,0.0,1.0,0.0,,,,,
v1hWN0s,cQBJe1JHd,"Cool gadget, but can it handle multiple speakers in a noisy environment?",3.0,0.0,1.0,0.0,,,,,
v1hWN0s,cQIfGtdwo,AiPod,5.0,0.0,0.0,0.0,,,,,
v8TdcdK,cQJur8Nhe,U could have use Google translate instead grinning face with sweat,2.0,0.0,0.0,0.0,,,,,
v9edfKB,cQWKQFBPi,"Die Unterstützung für über 70 Sprachen ist beeindruckend, aber ich frage mich, ob die Qualität bei weniger verbreiteten Sprachen genauso gut ist?",3.0,0.0,1.0,0.0,,,,,
v8TdcdK,cR1wSbKU0,Just use your phone face with tears of joy,2.0,0.0,0.0,0.0,,,,,
vpOtjW1,cRF8IHFlO,Can the Xfaiyx Smart Translator handle simultaneous translations during video calls? This would be useful for remote job interviews.,4.0,0.0,1.0,0.0,,,,,
v8TdcdK,cRGeMzghN,this is the best app for carrie and apnavi,5.0,0.0,0.0,0.0,,,,,
vpOtjW1,cRlUgyr2u,"Used the Xfaiyx Smart Translator during a business meeting in Frankfurt. It was smooth and efficient, but the device overheated after prolonged use.",3.0,1.0,0.0,0.0,,,,,
v1hWN0s,cRvrC0udi,That should be an app,2.0,0.0,0.0,0.0,,,,,
vKlzOiZ,cRydP7NOc,"요즘 갤럭시에 포함되어있는 번역기 기능하고 어떤부분이 장점인지 궁금하네요. 디바이스를 추가로 들고 다녀야하는데, 그런것들을 감수할 수 있는 장점을 알려주시면 좋을것 같아요 face with tears of joy",4.0,0.0,1.0,0.0,,,,,
vpOtjW1,cS3EGh-2J,"Does the Xfaiyx Smart Translator support multiple languages simultaneously? For example, switching between German and French during a conversation?",4.0,0.0,1.0,0.0,,,,,
vhTHDT-,cS_PhuH4i,Does it support translating slang or informal phrases? That would be awesome!,1.0,0.0,1.0,0.0,,,,,
v3T6mPl,cSd29WybN,will it work in Scotland?,4.0,0.0,1.0,0.0,,,,,
vb-WyHa,cSfnI1dhw,I hope they add voice recognition for noisy environments in the next version.,4.0,0.0,0.0,1.0,,,,,
vhTHDT-,cSh2S7Ou_,Can you use this without Wi-Fi? That would make it perfect for remote areas.,1.0,0.0,1.0,0.0,,,,,
vmCnKGQ,cT9GyTzWj,Does this support multiple languages for the voice-to-text feature? That would be super helpful.,4.0,0.0,0.0,0.0,,,,,
vbesCCb,cTGLeCtJk,Google Übersetzer kostenlos und funktioniert gut genug.,2.0,0.0,0.0,0.0,,,,,
vJUEX3u,cTTM6oSmP,Kann der Xfaiyx auch direkt mit Cloud-Diensten synchronisiert werden? Das wäre für meine Arbeit sehr praktisch.,4.0,0.0,1.0,0.0,,,,,
vUt-uCX,cTfYu_F9C,how much it costs thinking face,1.0,0.0,1.0,0.0,,,,,
v8TdcdK,cTup2N_iC,Use Google translate,2.0,0.0,0.0,0.0,,,,,
vB3iY9I,cUPvXzPHG,"I regret buying the Xfaiyx Smart Recorder. The app integration is buggy, and customer support hasn't been helpful.",2.0,0.0,0.0,0.0,,,,,
v3T6mPl,cUUx35hfE,Does it support multiple languages for transcription? That would be amazing.,1.0,0.0,1.0,0.0,,,,,
v1hWN0s,cUXKQ3ys9,looks cool but the recorder app on the pixel already does all this.,3.0,0.0,0.0,0.0,,,,,
v1hWN0s,cUd94w4XA,Imagine using this to figure out what your grandma’s REALLY saying about you.,4.0,0.0,0.0,0.0,,,,,
v8TdcdK,cUkhN4k3o,This is dumb,2.0,0.0,0.0,0.0,,,,,
v1hWN0s,cUlQ8KhOh,There are many apps that do that. It reminds me of my iPod just taking dust in a drawer,2.0,0.0,0.0,0.0,,,,,
vQjtjf2,cUoObvPJ8,¿Traduce texto además de voz? Esto sería perfecto para negocios.,1.0,0.0,1.0,0.0,,,,,
v9edfKB,cVTf6465i,"Das Gerät ist cool, aber ich frage mich, ob die integrierte SIM-Karte zusätzliche Kosten verursacht?",1.0,0.0,1.0,0.0,,,,,
vmCnKGQ,cVccu1T0d,Worth the investment for busy schedules.,5.0,0.0,0.0,0.0,,,,,
v3T6mPl,cVrNhGTf2,How much storage does this device have? Can it handle long recordings?,4.0,0.0,1.0,0.0,,,,,
vKlzOiZ,cVs7DbOGq,"이 제품의 음성 인식 기능이 정확하지 않다는 리뷰를 봤는데, 실제로 사용해보신 분들의 의견이 궁금합니다.",4.0,0.0,1.0,0.0,,,,,
v8TdcdK,cW1765g8F,She still didn't charge the translator Looool face with tears of joy,4.0,0.0,0.0,0.0,,,,,
vWN5LPe,cW80FfVdh,"The Xfaiyx Smart Translator is great for quick translations, but I feel like it struggles with technical jargon. Maybe an update could fix this?",3.0,1.0,0.0,1.0,,,,,
vbesCCb,cWNvhmx1o,mit meinem Smartphone kann ich Schach spielen bræche selten bis nie sprachübersetzer,5.0,0.0,0.0,0.0,,,,,
v1hWN0s,cX00iyW60,"I love the portability, but the storage capacity feels limited for long recordings.",3.0,0.0,0.0,0.0,,,,,
viVgLsZ,cX0AbEsVN,Schafft das Xfaiyx auch Übersetzungen bei Telefonaten wie das heutige s24?,4.0,0.0,1.0,0.0,,,,,
v1hWN0s,cX0CWlBhX,"Great tool for journalists, but the price seems a bit steep compared to similar devices.",3.0,1.0,0.0,0.0,,,,,
vTdqmte,cX63X98-7,I love how compact the Xfaiyx Smart Translator is! Perfect for minimalist living in a van. Definitely worth the investment.,1.0,0.0,0.0,0.0,,,,,
vmCnKGQ,cXQC0M9KA,How durable is it for daily use?,4.0,0.0,1.0,0.0,,,,,
vbesCCb,cYGE58Cw3,"Das Gerät ist cool, aber ich würde mir wünschen, dass es leichter ist. Es fühlt sich etwas schwer an für unterwegs.",3.0,0.0,0.0,1.0,,,,,
v1hWN0s,cYLP4ZYgP,so it doesn’t work if i want to record spanish?,2.0,0.0,1.0,0.0,,,,,
vWN5LPe,cYYWICaQh,"The Xfaiyx Smart Translator is okay, but I think it needs a better microphone for clearer input during noisy environments.",3.0,0.0,0.0,1.0,,,,,
v4g6avX,cYfyciOTl,The voice recognition sometimes fails in noisy environments. confused face,2.0,0.0,0.0,0.0,,,,,
v8TdcdK,cZ7Sh2IVe,It had Malayalam,4.0,0.0,0.0,0.0,,,,,
v1hWN0s,cZRTj0QsJ,why needing seperate hardware when the phone can do the same natively or with an app?,2.0,0.0,1.0,0.0,,,,,
v8TdcdK,c_3czOodo,Telugu please,5.0,0.0,0.0,0.0,,,,,
vB3iY9I,c_FC2kNUq,Can the Xfaiyx Smart Recorder record in multiple formats like MP3 and WAV? That would be really useful for my projects.,4.0,0.0,1.0,0.0,,,,,
v4g6avX,c_MPZa-qn,"It’s good, but sometimes struggles with complex sentences. light bulb",3.0,0.0,0.0,0.0,,,,,
v1hWN0s,c_b1Cusfx,will it work in Scotland?,4.0,0.0,1.0,0.0,,,,,
vbesCCb,camcbuj8Q,wo bekommt man dieses Handy,1.0,0.0,1.0,0.0,,,,,
vpOtjW1,cb3Ol_zLY,"I bought the Xfaiyx Smart Translator last month, but I found its accuracy in translating technical terms to be inconsistent. This could be a problem for job applications in Germany.",2.0,1.0,0.0,0.0,,,,,
v4g6avX,cb4yyltq2,"I tried the older version, but it struggled with slang. Hope this new one is better! light bulb",3.0,0.0,0.0,1.0,,,,,
v8TdcdK,cbgg2bjEG,Google translate crying face,2.0,0.0,0.0,0.0,,,,,
vr9Mebt,cbq0ZMNAH,Does Xfaiyx have a feature for translating slang? That would be super useful for casual conversations.,1.0,0.0,1.0,0.0,,,,,
vmCnKGQ,ccZ-cqNbi,How durable is this device? Can it handle being carried around daily?,4.0,0.0,1.0,0.0,,,,,
v9edfKB,cdPE3UMkq,"Die Idee eines Fotoübersetzers ist interessant, aber die Qualität der Übersetzung könnte besser sein. Manchmal sind die Ergebnisse ungenau.",3.0,0.0,0.0,0.0,,,,,
vB3iY9I,cdo45ep20,Does the Xfaiyx Smart Recorder have noise-cancellation features? I need something reliable for outdoor recordings.,4.0,0.0,1.0,0.0,,,,,
ve33QLn,cdx1H___R,"Espero que en la próxima versión mejoren la velocidad de traducción, a veces tarda demasiado.",2.0,0.0,0.0,1.0,,,,,
v3T6mPl,ceTPwTh3c,Dictaphone,4.0,0.0,0.0,0.0,,,,,
vJUEX3u,ceTW0GMnA,"Wie lange hält der Akku des Xfaiyx normalerweise? Ich möchte sicherstellen, dass er für lange Meetings geeignet ist.",4.0,1.0,1.0,0.0,,,,,
v8TdcdK,ce_nRCNHH,Does this device support real-time translation for group conversations? That would be a game-changer.,4.0,0.0,1.0,0.0,,,,,
v1hWN0s,cfM-nYeH9,250$ Nope,2.0,0.0,0.0,0.0,,,,,
vmCnKGQ,cfQvND-u-,The build quality feels cheap. Not sure how long it will last with regular use.,2.0,0.0,0.0,0.0,,,,,
v1hWN0s,cfRZnsMC_,can you use as Translator. real time,4.0,0.0,1.0,0.0,,,,,
v3T6mPl,cfUIutOru,That should be an app,2.0,0.0,0.0,0.0,,,,,
vKlzOiZ,cfgB7DX6K,이 통역기의 크기가 휴대하기 편한가요? 여행용으로 적합한지 알고 싶습니다.,4.0,1.0,1.0,0.0,,,,,
vpOtjW1,cflbakWnh,Does this translator come with a warranty? I’m worried about durability since I’ll be traveling a lot for job interviews.,4.0,1.0,1.0,0.0,,,,,
vmCnKGQ,cgaW7HHCD,"Overall, looks like a great tool for anyone who needs to capture ideas quickly. Thanks for the review",1.0,0.0,0.0,0.0,,,,,
v9edfKB,cgktqaH-1,"1. Fürs Sprachenlernen brauchst du kein Talent nur, muss es nur regelmäßig lernen und dranbleiben dann machst du Fortschritte 2. Wenn du dennoch ein Überetzer benutzt ist es ok",5.0,0.0,0.0,0.0,,,,,
vr9Mebt,chlFWwgr6,Does it work offline? I’m worried about using it in areas without internet access.,4.0,0.0,1.0,0.0,,,,,
vpOtjW1,ci8zfZJzG,"I’ve been using the Xfaiyx Smart Translator for networking events in Germany, and it’s been very helpful. However, the battery life is too short for all-day use.",3.0,1.0,0.0,0.0,,,,,
v3T6mPl,ciYo8sSUR,Why would I buy this when my phone already has a voice recorder app?,2.0,0.0,1.0,0.0,,,,,
