video_id,comment_id,comment_text,sentiment_category,user_scenario,user_question,user_suggestion,positive_cluster_theme,negative_cluster_theme,scenario_cluster_theme,question_cluster_theme,suggestion_cluster_theme
vKJ2vqX,ckCfeX0_m,"Meru bhai, Janamdin ki hardik shubhkamnaye aapko. I am a viewer since 3 years but never a dull moment. Keep growing.",,,,,,,,,
vjEBu9W,ckD-klRsx,Yay for geylang getting their time to shine,,,,,,,,,
vJOK_jc,ckF-Z0yWT,Aip program is closed ??,,,,,,,,,
vlbVrtw,ckGJggqxY,「カンパ~イ」からの 第一呑視 やっぱりレナちゃん 一番速かったね double exclamation mark (笑) 当然だよね double exclamation mark (笑),,,,,,,,,
v95aInR,ckHQW2pqF,"Nie ufam takim ludziom. Jest super, sprzedaże, mamy mieszkania, za darmo jest, fajnie, pogoda ogólnie super. Tacy ""Janusze"". Czerwona lampka.",,,,,,,,,
vyumcj7,ckIvuVQy2,grinning face beaming face with smiling eyes family woman woman girl woman running,,,,,,,,,
vnK5t9y,ckKFMmvxB,案件なのにちゃんといい情報くれるオネーサン。,,,,,,,,,
vnK5t9y,ckKZ68F3E,ジャパネットたかたに 負けない話術!! さすがディアナさん、 ニャハハ!! grinning face with smiling eyes,,,,,,,,,
v4Htv2Q,ckKkll7wy,"I regret buying this translator. It kept freezing during my trip to Xi'an, making it almost useless.",,,,,,,,,
vKJ2vqX,ckLIuiUrO,Wishing Meru a very Happy Birthday,,,,,,,,,
vlbVrtw,ckLjSwNk5,柚子胡椒、おいしいですよね thumbs up みそにもよく合うので豚汁や豚の味噌焼きなんかと召し上がれ smiling face with smiling eyes,,,,,,,,,
vOU2rJb,ckMBbsb4F,"I found your unboxing and review of the Xfaiyx Smart Recorder informative and engaging. The design is sleek, and your insights into its features have made me interested in its potential uses.",,,,,,,,,
vnK5t9y,ckMDY3T95,ディアナ嬢の知ってるロシア人youtuberがロシアで日本語を勉強してる女性が増えているって動画を出してたよ...まぁディアナ嬢クラスの美人じゃなくても美人度が高いロシア人女性は日本もwelcomeする時期かも red question mark にゃはは,,,,,,,,,
vtFQ8Km,ckMshCz2-,Well my main question is how does the offline feature compare to Google Translate offline?,,,,,,,,,
vJAQbN9,ckP-Yp_Ox,"Tolles Teil, leider zu teuer",,,,,,,,,
vnK5t9y,ckP5-P03f,日 white circle と和 white circle の辞書をリュックに入れて仕事してましたね rolling on the floor laughing 以外と英 white circle white circle 英が欲しくなりました ところで それ以上痩せてどーすんねん downcast face with sweat 好きなもの食べなさい smiling face with open hands,,,,,,,,,
vgIr-dG,ckTtoJEhi,你们的英文说的好流畅 face with tears of joy,,,,,,,,,
v2cabia,ckU_azFzT,show the out life of your house,,,,,,,,,
vytrCKr,ckUj0sI9T,Excelente video,,,,,,,,,
vMSQja0,ckUqSlltm,"I used Xfaiyx Smart Translator during my trip to France, and it was incredibly helpful for communicating with locals. The offline mode is a lifesaver!",,,,,,,,,
vyTFg05,ckVvygooX,Your village home like a dream house Aap boht khoshqismat ho,,,,,,,,,
vMSQja0,ckWCwYh7A,"pdd出来之前,工厂比质量,它出来之后工厂比价钱,它对于社会来说是一种退步,pdd导致中国商品质量变差功不可没",,,,,,,,,
vdbLgWS,ckWFOKtUI,This is very nice,,,,,,,,,
vnK5t9y,ckWSU-Rqz,何気に凄い商品だw でも翻訳器では口説けない... 大阪弁と津軽弁に対応してますか?,,,,,,,,,
vgIr-dG,ckXjCX_dP,Back party popper party popper party popper Happy! partying face I found that you seem to have become thinner in this video. face with tears of joy Have a nice travel red heart,,,,,,,,,
vgIr-dG,ckYaSoTDG,Very interesting and beautiful streets to start with your newest series of China travel. thank you both for bringing us to see more about China. party popper red heart smiling face with smiling eyes smiling face with smiling eyes,,,,,,,,,
vKJ2vqX,ckZ5JORV0,Wishing you happy birthday bouquet bouquet bouquet bouquet bouquet bouquet bouquet,,,,,,,,,
vIiTZO1,ckZZuSZmJ,face with tears of joy face with tears of joy face with tears of joy,,,,,,,,,
vyTFg05,ck_FD8BLF,Beautiful weather beautiful village OK hand OK hand OK hand I love this type of village,,,,,,,,,
vgIr-dG,cka-x9rsw,诶嘿 smiling face with smiling eyes,,,,,,,,,
vz-3GxD,cka7vPTyb,"不行,他们不能去,那里坚决不能去!!!!因为 我还没去过,我会嫉妒!哼 confused face confused face",,,,,,,,,
vyTFg05,ckaNfQqAQ,Aslwkm,,,,,,,,,
v4wSOpe,ckeYpUTDN,face with tears of joy face with tears of joy face with tears of joy,,,,,,,,,
vjqfJjv,ckfkLGM_o,smiling face with hearts smiling face with hearts smiling face with hearts,,,,,,,,,
vB0lLSM,ckgeiuZ3_,この翻訳機、使い方が簡単だけど、バッテリーの持ちが少し短い気がします。長時間使えるように改善してほしいです。,,,,,,,,,
vgIkaeR,ckgj1EyW8,Pogi mo nhàn,,,,,,,,,
vZBnD1J,ckgnanJVz,"Yeah, if an app can handle it,why should I buy face with tears of joy",,,,,,,,,
vz0DmiM,ckhT7Y9Q-,"I used this during a conference, and the battery lasted all day. Highly recommend it!",,,,,,,,,
vIiTZO1,ckhXPhW_P,beaming face with smiling eyes beaming face with smiling eyes beaming face with smiling eyes,,,,,,,,,
vusOhpE,ckjA4bWra,"I tried using it for a lecture, but the sound quality wasn’t great.",,,,,,,,,
vbzCZ0h,ckjP6vIOJ,"I used the Xfaiyx Smart Recorder during my podcast recording session, and the audio quality was crystal clear. Highly recommend it for content creators!",,,,,,,,,
vz-3GxD,ckjp4IQQk,"很棒的企劃~很溫暖的影片,融化了每個人心中的隔閡!!也為您鼓掌~ red heart red heart red heart",,,,,,,,,
vIiTZO1,ckjs3-z6R,This video is so good smiling face with hearts,,,,,,,,,
vJOK_jc,ckkY9QcNB,Very informative video...thank you thumbs up,,,,,,,,,
v4Htv2Q,ckliap3lo,欢迎你们再次旅游中国 smiling face with hearts smiling face with hearts,,,,,,,,,
vKJ2vqX,ckoAn_bZG,Happy Birthday Meru Bhai,,,,,,,,,
v0nP_KB,ckpQ1J9J-,but it's a Google feature. the assistant is knowing it too for free,,,,,,,,,
vIiTZO1,ckqEPW3pk,This video is so good,,,,,,,,,
vKJ2vqX,ckr3xHJs2,Delhi se tha noidu se hu ma kashmir to hai hi ni Instead you should say delhi se tha noida se hu aur kashmiri rahuga,,,,,,,,,
vgIr-dG,ckrI8TIru,"red heart red heart red heart finally you guys went back!!! I luv all ur videos in China, I’m planing to visit next year.",,,,,,,,,
vgmyU_t,ckreCcc7F,what was the use of your phone?,,,,,,,,,
vgIr-dG,cktnGKJlh,"as a chinese,welcome you back to china red heart smiling face with smiling eyes",,,,,,,,,
vnK5t9y,ckv4Dd_OD,翻訳は便利だけど自分の言葉で頑張ってつたえようとしてる人のが魅力的にうつるな あくまで私は、だけどね,,,,,,,,,
v0nP_KB,ckvL-YerL,"I love the idea of real-time voice translation, but does it handle accents well? thinking face",,,,,,,,,
vgIr-dG,ckwNlXWci,Have you been to Beijing yet,,,,,,,,,
vOREHMM,ckxWXWZXX,I love how many languages it supports. Very versatile.,,,,,,,,,
vdKeRm9,ckxdMY9yw,du bist so süß,,,,,,,,,
vyTFg05,ckyQR8AqW,Nice OK hand light skin tone,,,,,,,,,
vb-Daa_,cl0Yx6ObQ,I wish the Xfaiyx Smart Translator had a faster response time—it sometimes takes too long to process translations.,,,,,,,,,
vdKeRm9,cl0ZEd0pH,"5:00 Das ist einfach ein getunter krankenwagen , der fährt sogar auf TE37 face with tears of joy face with tears of joy face with tears of joy",,,,,,,,,
vz-3GxD,cl1LUshYG,"谢谢你宣传新疆的真实样子,那是我出生的地方。",,,,,,,,,
vIiTZO1,cl1f-HM8M,flushed face flushed face flushed face,,,,,,,,,
vKJ2vqX,cl2nOumGk,Happy birthday,,,,,,,,,
vgIr-dG,cl53VkG5M,Welcome back. Look forward to your exploration,,,,,,,,,
vyTFg05,cl5ItwKd8,ماشاءالله,,,,,,,,,
vz0DmiM,cl6ef8CQY,"The transcription feature is innovative, but I wish it supported more languages.",,,,,,,,,
vvyoPyo,cl828uX1z,Can this handle translating full paragraphs or just short phrases?,,,,,,,,,
vMSQja0,cl8P8LACF,好用吗? 我家很需要这个翻译机 我打算明年带我的美国老公和混血女儿回国探亲 我老公一句中文都不会,,,,,,,,,
vc_of-A,cl8ZY7XW6,smiling face with hearts smiling face with hearts smiling face with hearts,,,,,,,,,
vVS_NZR,clB-pb0UD,"sé que las traducciones están de la cola cuando dijo ""dolor afilado""",,,,,,,,,
vOREHMM,clB4-CyQM,Is it compatible with other translation apps?,,,,,,,,,
vRoMHNQ,clCOYh7qi,今までの中で一番好きな回かも,,,,,,,,,
vyumcj7,clFIGeaCA,"Honestly, my Samsung Buds3 Pro does the same thing and costs less.",,,,,,,,,
vb-Daa_,clGrDpzfe,Does the Xfaiyx Smart Translator support offline mode? I’m planning to use it during my travels where Wi-Fi might not be available.,,,,,,,,,
vVS_NZR,clH5uhW8Q,"Hola, mi nombre es Este Van, estoy hablando es pañol face with tears of joy",,,,,,,,,
vgIr-dG,clIUKevtH,"You may try posting your wonderful travel videos on Chinese social media platforms as well. There’s a Chinese saying similar to 'kill two birds with one stone,' which fits this context, as you can earn from both Western and Eastern platforms with one video. Use AI for Chinese subtitle translation.",,,,,,,,,
vusOhpE,clIZj9Alk,Turned out great star,,,,,,,,,
vgIr-dG,clLcg3BLk,red heart face with tears of joy party popper red heart face with tears of joy party popper,,,,,,,,,
v4Htv2Q,clMi6ZU0Q,Hey guys hope you both had a great time in Chinatown in london? When in October you off to China? The device you got is so good but expensive,,,,,,,,,
vZNFtEb,clND0mITG,나만 설레나요. 자동차 안에서 너무 자연스러운 무브 red heart,,,,,,,,,
vIiTZO1,clNG9zhOq,beaming face with smiling eyes beaming face with smiling eyes beaming face with smiling eyes,,,,,,,,,
vIiTZO1,clRDcR2BM,Simply fantastic! glowing star,,,,,,,,,
vb-Daa_,clS0wi5Uk,Enjoying these. We sail on Arvia 12th October so giving us a good insight!,,,,,,,,,
vRoMHNQ,clTcESoS_,若いのにとても紳士で穏やかな青年でしたね。日本の大晦日を楽しんで欲しいですね。 そして、エンディングの「後日、写真送ってくれました」はあったけど、写真がなかったですよ〜 grinning face with sweat あと、テロップの脱字がいくつか。投稿前のチェックは入念に。,,,,,,,,,
vTOfPvS,clUs9VBM5,"The features on this smart recorder are incredible, and the price is unbeatable, thanks for sharing!",,,,,,,,,
v-ox8Uw,clVJ4jxnj,Die Dinger benutzen die auch bei der Bundeswehr,,,,,,,,,
vUG_xbR,clWC3ZSDg,I can see this translator being super useful on my trips abroad.,,,,,,,,,
vytrCKr,clY6MZppd,"Alfin un dispositivo interesante y sensato, jajaja solo entraba para verte face savoring food , rolling on the floor laughing face with tears of joy rolling on the floor laughing",,,,,,,,,
vKJ2vqX,clZOAedEj,red heart Happy birthday bro red heart,,,,,,,,,
v4wSOpe,clZUg8wr_,"I used it during a business meeting, and it transcribed everything perfectly. Highly recommend!",,,,,,,,,
vgIr-dG,clZlP_e6J,Glad you guys have sponsors to support you star-struck,,,,,,,,,
vIUVexk,clZu8-Ko2,"El diseño está bien, pero deberían incluir una funda protectora en el paquete.",,,,,,,,,
vgIr-dG,cl_vhO-D9,"I spent the last six months in Qingdao, such a wonderful city.",,,,,,,,,
v129LuD,cla9BBwPN,@Ayanda Gebashe bro you need this a frequent traveler,,,,,,,,,
vgIr-dG,clapmQWAU,Xiexie for coming~~back!,,,,,,,,,
v4wSOpe,clc4gC15I,thumbs up,,,,,,,,,
vr_LT5A,clcMARb4r,"劉若英的歌就像是一個個故事,從青澀到成熟,乾淨的聲音讓人容易沉浸其中,對我來說聽的時候不僅僅是一首歌,更是一個故事、一個回憶。",,,,,,,,,
vgIr-dG,cleCV0F5H,"好厉害,拿到Xfaiyx的业配了,有一说一,Xfaiyx的确是中国翻译设备的顶流。",,,,,,,,,
vc_of-A,clh2pp5bP,Oui il exagère depuis le temp ppffff,,,,,,,,,
vgIr-dG,cljYyWnl0,"把辣椒放在醋里就行,谢谢",,,,,,,,,
vvyoPyo,clm26Pq_J,face with tears of joy face with tears of joy face with tears of joy,,,,,,,,,
vIiTZO1,clnFkN611,face with tears of joy face with tears of joy face with tears of joy,,,,,,,,,
vgIkaeR,clpc2uojJ,Hello friend!! I'm very big fan of you; lots of love red heart from India Assam red heart red heart red heart red heart big people hugging people hugging,,,,,,,,,
vvyoPyo,clqWwi_OJ,"I tried using this during my vacation, but it struggled with some local accents. Hope they improve that in future updates.",,,,,,,,,
vIiTZO1,clrjJaGKB,smiling face with hearts,,,,,,,,,
vOqoEVw,cls83zCTA,"Tutti noi non vediamo l'ora di vedere il titolo ""HOME TOUR"".. Forza ragazzi!! Per il parquet quando ho visto le cose poggiate ho pensato la stessa cosa.. immagino voi che avete investito soldi e stress!!",,,,,,,,,
vOU2rJb,cltg2e9l7,"I love the lightweight design, but I wish the Xfaiyx Smart Recorder had a longer warranty period for peace of mind.",,,,,,,,,
vJAQbN9,cltpsEKNZ,Ich habe ihn bei einem Festival mit vielen internationalen Gästen getestet und er hat super funktioniert! party popper,,,,,,,,,
vMSQja0,clu-9l79f,"Does this translator support Vietnamese? I have many friends who speak Vietnamese, and I want to make sure it works well for them.",,,,,,,,,
vyTFg05,cluM7ZN9W,Itna acha hai hygiene aur healthy life toh aap kyu nahi rahte... Sahet se badhke life me kuch nahi... Aapko Saath rahna chahye India me ... Who agree with me,,,,,,,,,
vJAQbN9,clvEn8jhh,"Ich nehme übersetzer Wooask (knopfhörer schon dabe)i für vietnamesisch ( Frau ) mit Kopfhörer(knöpfe) geht es noch besser, sie hört die Übersetzung und kann gleich antworten",,,,,,,,,
vnK5t9y,clvWOCYO5,オーチンハラショー。スパシーバ。,,,,,,,,,
vhLcap1,clx3rFBDP,Nice. Thanks Matt.,,,,,,,,,
vIiTZO1,clyf6oD0O,smiling face with hearts smiling face with hearts smiling face with hearts,,,,,,,,,
v3-vK-4,cm19QXI5A,Pensa se come a Roma ti avessero riconosciuto? grinning face with sweat face with tears of joy,,,,,,,,,
vKJ2vqX,cm1dol4sZ,Happy birthday meru bhai party popper,,,,,,,,,
vgIr-dG,cm22Xf5-Y,"Friend, you should register an account on the Chinese Internet platform, which will bring you double YT income. Wishing you a pleasant trip to China!",,,,,,,,,
v_Ur2e7,cm29RAhoa,WOW beaming face with smiling eyes This could be great for students studying abroad!,,,,,,,,,
vdbLgWS,cm3CFD322,"Atti and Liz come visit Finland especially winter, you probably see snow crying face",,,,,,,,,
vjqfJjv,cm3n4U20C,I once said something in Spanish and someone “repeated” what I said in english... “YOUR DAD STOLE MONEY FROM A DANCING FOOTBALL TEAM??”,,,,,,,,,
vej5bIY,cm46Y60EX,"I'm not an american, but as far as I know , in the US nobody can collect rainwater, it's a silly law, but it's illegal in the US",,,,,,,,,
vc_of-A,cm4JXyu2g,"Je l'ai utilisé pour commander dans un restaurant en Espagne, et ça a parfaitement fonctionné !",,,,,,,,,
vTOfPvS,cm5m21jc0,"Your video is so helpful, I wouldn't have known about this deal otherwise, thanks!",,,,,,,,,
vlbVrtw,cm8P0pxsn,パパもママもなんか若くなった face with open mouth red heart,,,,,,,,,
vcU7cYQ,cmAYiXCq8,are there apps as alternative for people who cant afford it?,,,,,,,,,
vgIr-dG,cmArXI2Kf,Welcome to the hospitable Shandong party popper,,,,,,,,,
vOREHMM,cmCHm2SKy,The speed of translation is definitely attractive.,,,,,,,,,
vZNFtEb,cmCYsNKg5,식품에 쓰는거는 방부제 아니고 보존제 입니다. ᄒ,,,,,,,,,
v4wSOpe,cmCzBJIfQ,My Samsung does that,,,,,,,,,
vKJ2vqX,cmDYBLInk,love from Assam,,,,,,,,,
vhIxU0L,cmFij71i4,"I don’t understand you bruf, but maybe this translator can help. thinking face",,,,,,,,,
vz-3GxD,cmG1GtqAn,Thanks for showing real XinJiang.,,,,,,,,,
vRoMHNQ,cmGDouSDu,この翻訳機はどのくらいの距離まで音声を拾えますか?大人数の会話にも対応できますか?,,,,,,,,,
vz-3GxD,cmGl5FqDX,"看看币哥个人力量要帮中国澄清那些被西方主流媒体全面的抹黑多么辛苦,造谣出张嘴辟谣跑断腿。感谢币哥。 red heart red heart red heart red heart red heart red heart",,,,,,,,,
vz-3GxD,cmIPTkhlk,支持您 red heart,,,,,,,,,
v2cabia,cmJFOGc-u,crying face red heart red heart red heart,,,,,,,,,
vlbVrtw,cmJMbhYLk,raised hand 両親と一緒に四国香川うどん(石川うどん店)に食べに行って欲しいです。,,,,,,,,,
vyTFg05,cmKKvFnZd,Nice vlogs,,,,,,,,,
vb-Daa_,cmKbLc0aD,"The Xfaiyx Smart Translator looks interesting, but how does it compare to other translators like Pocketalk or Langogo?",,,,,,,,,
vtFQ8Km,cmLEplnzW,"Yeah, not sure how this is supposed to be better than Google Translate. I guess it could be useful for an older generation that's not skilled with smartphones.",,,,,,,,,
vyTFg05,cmLrR9jqs,Which doctor did you consult even I am having the same problem I live in mangalore city,,,,,,,,,
vOqoEVw,cmMK-aO8r,Io e il mio compagno ormai sembriamo due muratori architetti ecc ecc siamo sempre in casa a controllare la ristrutturazione che sembra non finire mai speriamo di essere quasi alla fine rolling on the floor laughing casa verrà stupenda ragazzi facciamoci forza red heart red heart face with tears of joy,,,,,,,,,
vwm_9ft,cmN4OdOCc,The battery life is too short for long conferences. Please improve it in the next version.,,,,,,,,,
vyTFg05,cmNhQuSXI,Liken aapne kaha tha aap mummy ke yaha jayegi liken aap gaye nahi aap Dubai jane ki bat ker rahi ho thinking face,,,,,,,,,
vgIr-dG,cmPhlzGjc,well come be back,,,,,,,,,
vgIr-dG,cmQ47LNUL,"通常吃包子应该配一碗汤,要不然太干了不容易下咽。但你吞咽得如此顺畅,一定是馋得满口唾液 face with tears of joy face with tears of joy face with tears of joy",,,,,,,,,
vhIxU0L,cmQTlbn5c,Lol my friend had to recite the colours of the rainbow. “Red... Frog... Yellow... Apple... White... Purple.” HOW DID SHE MESS UP ORANGE IT WAS THE EASIEST ONE-,,,,,,,,,
vr_LT5A,cmShUMi91,this song reminds me about my friend who died 11 yrs ago.,,,,,,,,,
vMULQIS,cmTiovRo6,@reese martinez UM HEYY??!!,,,,,,,,,
vUfYwzN,cmTjQwi7m,"The design and build quality are impressive, but I feel the price is a bit steep compared to other recorders with similar features.",,,,,,,,,
vlbVrtw,cmUnANoyt,失礼な言い方だけどご高齢の方がモリモリ食べてるところは見ててほっこりする 結構歯ごたえありそうなものも難なくいける丈夫な顎も健在で素晴らしいですね smiling face with smiling eyes,,,,,,,,,
vJAQbN9,cmVeS0T6J,ich kann keine Sprache ordentlich grinning face with smiling eyes thumbs up,,,,,,,,,
vOqoEVw,cmWr_vnzi,"Ciao ragazzi, vi perdono perché il vlog è lungo come piace a me! Dopo dieci giorni non potevo proprio più aspettare face with tears of joy face with tears of joy La casa sta venendo davvero bene, non vedo l'ora di vedere l'home tour di quando sarà tutto completamente finito!! Vi confesso però che ho un debole per la casa in campagna. Io mi trasferirei li!! La cucina lì sta diventando davvero accogliente e carina, bravissimi! Inoltre, un enorme complimento a Cesar. Sa veramente fare tutto face with open mouth bisogna faccia un po' di scuola al mio moroso face with tears of joy face with tears of joy Esigo di vedere un nuovo vlog prestissimo face with tears of joy red heart",,,,,,,,,
vZNFtEb,cmXTlONuz,如果你的视频提供中文字幕就完美了 smiling face with smiling eyes,,,,,,,,,
vKS-ol0,cmXjBPgg8,Gdzie to kupic,,,,,,,,,
vgIr-dG,cmZ1Sae0E,"小碟是装油辣椒的,喜欢的可以加些醋进去,蘸着小笼包吃。",,,,,,,,,
vz-3GxD,cmZ9YbzDm,"I think your approach is great, as it helps people from other countries better embrace different cultures. 不过挺可惜的,你的视频那么少人订阅。 加油 Tobi!",,,,,,,,,
vusOhpE,cmZqQRKSR,I used this for a group project and it was super helpful!,,,,,,,,,
vnK5t9y,cm_Jr8X6E,ディアナは商才あるな~笑,,,,,,,,,
vjqfJjv,cmc7ZhCtb,Why did you sound like mr tumble at the start face with tears of joy face with tears of joy,,,,,,,,,
vjEBu9W,cmckC11A0,Roti John 7$ at Geylang? damn did prices go up or did uncle do a wink wink,,,,,,,,,
vgIr-dG,cmdNvXv8u,"I'm going to Qingdao next week. You've all arrived in Qingdao, so you can also go to Linyi to have some fun",,,,,,,,,
vIiTZO1,cmdmsO9Mv,thanks Giovanna your are the best,,,,,,,,,
vdKeRm9,cmiheJbU-,"Ich habe den Xfaiyx Smart Translator auf meiner letzten Motorradtour getestet, und er hat mir wirklich geholfen, mit Einheimischen zu kommunizieren. Die Sprachausgabe ist super klar!",,,,,,,,,
vgIr-dG,cmk86xcGq,I’m so glad to see that you’re making a profit from the ads! I’m really happy for you all.,,,,,,,,,
vHahKrc,cmkSRiHOi,凄い製品ですね!これならどんな国でも安心して話せそう。,,,,,,,,,
v4wSOpe,cmmWI2O9M,"OMG, I need this!",,,,,,,,,
vnK5t9y,cmnY33WJh,ニャハハがない!!つまり...、,,,,,,,,,
v4Htv2Q,cmoM2AaW3,倫敦唐人街也要翻譯機 這很唐人 價格比香港平易,,,,,,,,,
v7lX8Ro,cmoNaR8Ys,I wish the battery life was a bit longer. It barely lasted through my 6-hour conference.,,,,,,,,,
vlbVrtw,cmp-Fow-3,わさび、脂っこいのに大概合うw,,,,,,,,,
vgIr-dG,cmpisZbhT,"first and forever i will watching because i fall in love with your content and i wil practice english start from now,take care and have beautiful trip china,welcome back to businese centre china no 1 of the world",,,,,,,,,
vz0mnPd,cmqSJ9xLF,"Ich habe den Xfaiyx Smart Translator bei einem Interview ausprobiert. Die Sprachqualität war gut, aber die Lautstärke könnte höher sein, besonders in lauten Umgebungen.",,,,,,,,,
vz0mnPd,cmr2B52vG,"Grundsätzlich eine coole Idee - scheint mir aber nichts für so viele Folgen zu sein, weil sich die Aussagen vermutlich irgendwann nur noch wiederholen werden. Und meinetwegen brauche ich die Leute auch nicht zu sehen. Ich meine wenn Du sagst dass das LKW-Fahrer sind, sehe ich keinen Grund daran zu zweifeln. Frage doch einfach mal, ob sie sich auf eine bloße Tonaufnahme einlassen würden ... oder wenn sie beispielsweise hinter einer geöffneten Tür stehen und man nur Dich in der Aufnahme sieht, nicht aber den Fahrer. Oder Du lädst den Fahrer im Rasthof auf eine Bratwurst ein und filmst eben nur den Tisch ... sowas in der Art.",,,,,,,,,
vc_of-A,cmr9cw1Uc,heart suit heart suit heart suit,,,,,,,,,
vgIr-dG,cmrrKlIXR,"24 RMB for all those tasty buns? Very good value. Also keep in mind the price in China is the final price ( no taxes ,no tip added after that). Here where i live, you have to pay 13% tax plus 20% tip. Some tourism place there is additional tourist tax!",,,,,,,,,
vgIr-dG,cmtwbqF33,Before first day in China China . Both of you been many months. Many foreigners returning back second time. That means they love red heart China. This city very popular food dumplings dumpling . Winter cold face very cold like Germany Germany .,,,,,,,,,
vIiTZO1,cmtzAIpn1,Nice smiling face with hearts smiling face with hearts smiling face with hearts,,,,,,,,,
v3-vK-4,cmvYUC1oH,Beh e un modo economico per alimentarsi ed assaggiare un pò di tutto,,,,,,,,,
vgXp8qe,cmvqoS4DY,smiling face with hearts smiling face with hearts smiling face with hearts,,,,,,,,,
vJAQbN9,cmz0Xv76Q,Cool für mein traum nach korea mit meiner tochtet wäre mega da sie Allergien hT würde es und echt retten spare weiterfür unseren traum und gür das gerät erzähle mehr davon!!! victory hand four leaf clover four leaf clover,,,,,,,,,
vKS-ol0,cn009FgLx,Gdzie to kupić?.,,,,,,,,,
vKJ2vqX,cn0UWbtYT,Happy birthday Meeru bhai partying face partying face confetti ball . May God fulfill all your wishes and bless you with all the happiness of life smiling face with smiling eyes,,,,,,,,,
v95aInR,cn0Vvi-kx,"Urządzenie wygląda na ciekawe, ale czy ktoś wie, czy można je łatwo naprawić w razie awarii?",,,,,,,,,
v4Htv2Q,cn0YGR2Zy,"I used Xfaiyx Smart Translator in Guangzhou, and it worked perfectly for Mandarin. However, it didn’t handle Cantonese well.",,,,,,,,,
vyTFg05,cn0gggTXr,Aapka weat kafi loss ho gaya hai aapki tabiyat to theek hai,,,,,,,,,
vc_of-A,cn1CTXM2L,@fcbarcelona,,,,,,,,,
v3-vK-4,cn2ChZt50,"把这个翻译器扔了吧孩子,有时候不准确啊",,,,,,,,,
vMULQIS,cn2N1xH7O,400 dollars when you can just use your phone person facepalming,,,,,,,,,
vKJ2vqX,cn2hdisJN,3:28 9:55 10:51,,,,,,,,,
vr_LT5A,cn4LcVP5U,Good song,,,,,,,,,
vbzCZ0h,cn7BYSwKK,It's on my pixel face with tears of joy,,,,,,,,,
vJAQbN9,cn8RAaqIX,kann die Deepl App auch und kostet nichts. nur offline kann es nicht.,,,,,,,,,
vIiTZO1,cnAYd0TAH,beaming face with smiling eyes beaming face with smiling eyes beaming face with smiling eyes,,,,,,,,,
vMSQja0,cnC20jhXP,我也愛墨西哥菜,,,,,,,,,
v2cabia,cnCdgIvVx,"2 year after i see your video,,,after that you very cute smiling face with smiling eyes",,,,,,,,,
vdbLgWS,cnEbuufaR,"Waoo liz i like how you are determined to solve problems, thanks for the update",,,,,,,,,
vwK0Ro5,cnEkeBPu_,"aree mcud, but the build quality feels cheap.",,,,,,,,,
vRoMHNQ,cnFvfwAa8,今日も、Good Job ! thumbs up thumbs up,,,,,,,,,
vz-3GxD,cnGMRuZl2,"感谢你让更多德国人了解真实的样子,加油!",,,,,,,,,
vdzrIP2,cnH3XmMK2,"It is essential to have this translator while traveling to other countries, even do not understand the respective language.",,,,,,,,,
vIiTZO1,cnHseNnGY,face with tears of joy face with tears of joy face with tears of joy,,,,,,,,,
vHahKrc,cnIJT_6XO,素晴らしいですね。いくらなんでしょう?,,,,,,,,,
vgIr-dG,cnJAIUX6i,"There's a German governor's mansion, a German courthouse, a catholic church. Don miss out",,,,,,,,,
vgmyU_t,cnJnboCMw,Is there a limit to the number of languages it can translate?,,,,,,,,,
vgmyU_t,cnKrClTFw,Can you download additional languages?,,,,,,,,,
vmsHv2Z,cnMGu8YY6,Does it come with cloud storage for recordings or is everything stored locally?,,,,,,,,,
v4wSOpe,cnPL-jfMv,fire fire,,,,,,,,,
vKJ2vqX,cnQroDtzk,Pura 1 din late happy birthday,,,,,,,,,
vyTFg05,cnQt6B7h8,Asslamoalaikum anwari & family,,,,,,,,,
